KEYWORD_SENTENCE_ID,POST_ID,AUTHOR,URL,TITLE,KEYWORD,KEYWORD_CATEGORY,SENTENCE_TEXT,MATCH_SUBSTRING,START_POSITION,END_POSITION
5cd63505df6b3f40a72da25091932e2c,ps0h44,scraper01,https://www.reddit.com/r/dataengineering/comments/ps0h44/is_anyone_here_still_using_apache_storm/,Is anyone here still using Apache Storm?,APACHE_FLINK,analytics,Wondering if anyone here prefers Storm above other stream frameworks like Flink and why.,Flink,75,80
197fcc949ab81f4e7ba40737280c95b3,pqty5b,scraper01,https://www.reddit.com/r/dataengineering/comments/pqty5b/stream_processing_tool_to_pair_with_kafka/,Stream processing tool to pair with Kafka,APACHE_FLINK,analytics,"Between spark streaming, apache flink and apache storm, what do you think sinergizes the best with Kafka",apache flink,26,38
7aee742060ef26a075cc0f30437ea4c5,pt90kg,ArunMu,https://www.reddit.com/r/dataengineering/comments/pt90kg/clickhouse_and_apache_pinot/,ClickHouse and Apache Pinot,APACHE_PINOT,datastores,I had posted my findings about both ClickHouse and Apache Pinot at [https://www.reddit.com/r/bigdata/comments/pse4gb/clickhouse\_and\_apache\_pinot/](https://www.reddit.com/r/bigdata/comments/pse4gb/clickhouse_and_apache_pinot/,Apache Pinot,52,64
2fb599e9c1c74e61888eaee72d28b65c,pryp6w,KimStacks,https://www.reddit.com/r/dataengineering/comments/pryp6w/less_than_1tb_of_data_what_tools_should_i_get/,Less than 1TB of data what tools should I get better at?,POSTGRES,datastores,"I read https://docs.dask.org/en/latest/spark.html and in the very last line it said and I quote  &gt; you are looking to manage a terabyte or less of tabular CSV or JSON data, then you should forget both Spark and Dask and use Postgres or MongoDB",Postgres,228,236
528da3019020b4da152cfea8c9a7aab0,pryp6w,KimStacks,https://www.reddit.com/r/dataengineering/comments/pryp6w/less_than_1tb_of_data_what_tools_should_i_get/,Less than 1TB of data what tools should I get better at?,POSTGRES,datastores, I’m a software developer using mostly django and Postgres  And wants to slowly improve my data engineering skills in tandem with my day to day,Postgres,51,59
a1a37fb930e19a9e9f2c0bbf1d4765b5,pr6xg5,onelostsoul115,https://www.reddit.com/r/dataengineering/comments/pr6xg5/python_code_test_interview_general_career_advice/,Python Code Test (Interview) + general career advice,POSTGRES,datastores," I've evolved from \~5 years of hardcore database work (Oracle, Postgres",Postgres,65,73
66b323852aaee672194f17311f678df0,ponhwq,ciskoh3,https://www.reddit.com/r/dataengineering/comments/ponhwq/advice_on_db_for_ml_project/,Advice on DB for ML project,POSTGRES,datastores, Which solution would you pick:  \- Local Postgres SQL (if the whole thing stays below 600 GB,Postgres,43,51
9426974b217465e41f3d02e7ec50db52,ponhwq,ciskoh3,https://www.reddit.com/r/dataengineering/comments/ponhwq/advice_on_db_for_ml_project/,Advice on DB for ML project,POSTGRES,datastores, \- Google cloud SQL with PostGREs server  \-Google BigQuery (not sure if this is needed,PostGREs,27,35
a3668f5afd3fa6e161e12bbd080a7101,pomqcg,dadadawe,https://www.reddit.com/r/dataengineering/comments/pomqcg/dbt_looker_whats_it_all_about/,"DBT, Looker, ... what's it all about?",POSTGRES,datastores," Aside from flashy interfaces, what would be the difference between me generating a view in PostgreSQL or using a tool like Denodo to virtualize my star schema on top of the storage layer",PostgreS,93,101
662ed0e6036fb804306e7ab55c288b60,po5kgw,marcosmarxm,https://www.reddit.com/r/dataengineering/comments/po5kgw/presentation_airbyte_airflow_on_gcp/,Presentation: Airbyte + Airflow on GCP,POSTGRES,datastores, Tomorrow I'll go over how to set up Airbyte + Google Composer on GCP and send data from a Postgres Database to BigQuery! If you're curious about how to leverage Airbyte with Airflow this is your chance,Postgres,92,100
0cd833fe4755f6fb0539b9df3dc0b145,pktcp3,noNSFWcontent,https://www.reddit.com/r/dataengineering/comments/pktcp3/can_someone_help_me_understand_the_difference/,Can someone help me understand the difference between the the docker-compose files?,POSTGRES,datastores,"   **The first docker compose file is  -**           version: '3.9'               #asking for a postgres database     services:       postgres:         image: postgres:9.6         environment:           - POSTGRES_USER=airflow           - POSTGRES_PASSWORD=airflow           - POSTGRES_DB=airflow         logging:           options:             max-size: 10m             max-file: 3               #asking for a webserver       webserver:         build: ./dockerfiles         restart: always         depends_on:           - postgres         environment:           - LOAD_EX=n           - EXECUTOR=Local         logging:           options:             max-size: 10m             max-file: 3         volumes:           - ./dags:/usr/local/airflow/dags           # - ./plugins:/usr/local/airflow/plugins         ports:           - 8080:8080         command: webserver         healthcheck:           test: [CMD-SHELL, [ -f /usr/local/airflow/airflow-webserver.pid ]]           interval: 30s           timeout: 30s           retries: 3   For the above docker compose file, the dockerfiles folder had Dockerfile with the following text -       FROM puckel/docker-airflow          RUN pip install requests     RUN pip install pandas  **The second docker compose file is -**         version: '3'     services:       postgres:         image: postgres:9.6         environment:           - POSTGRES_USER=airflow           - POSTGRES_PASSWORD=airflow           - POSTGRES_DB=airflow         ports:           - 5432:5432            webserver:         image: puckel/docker-airflow:1.10.1         build:           context: https://github.com/puckel/docker-airflow.git#1.10.1           dockerfile: Dockerfile           args:             AIRFLOW_DEPS: gcp_api,s3             PYTHON_DEPS: sqlalchemy==1.2.0         restart: always         depends_on:           - postgres         environment:           - LOAD_EX=n           - EXECUTOR=Local           - FERNET_KEY=jsDPRErfv8Z_eVTnGfF8ywd19j4pyqE3NpdUBA_oRTo=         volumes:           - ./examples/intro-example/dags:/usr/local/airflow/dags           # Uncomment to include custom plugins           # - ./plugins:/usr/local/airflow/plugins         ports:           - 8080:8080         command: webserver         healthcheck:           test: [CMD-SHELL, [ -f /usr/local/airflow/airflow-webserver.pid ]]           interval: 30s           timeout: 30s           retries: 3       When the second docker compose was stuck in a dependency hell, I noticed both were pulling the same Airflow puckel image",postgres,97,105
992d1b6ba23026d18a12219e440fe7ec,pknfs8,fatredbeaver,https://www.reddit.com/r/dataengineering/comments/pknfs8/advice_on_reflect_changes_to_contents_of_database/,Advice on reflect changes to contents of database based on refreshed scraped data,POSTGRES,datastores,"The data scraped is cleaned and inserted into a Postgres database using SQLAlchemy as a basic interface (nothing too complicated, similar to what you can find in tutorials",Postgres,49,57
c182c8778d44b5239f8799d1287ebb2a,pj6hoa,Away-Suggestion-5845,https://www.reddit.com/r/dataengineering/comments/pj6hoa/a_case_study_example_for_an_interview/,A Case Study Example for an Interview,POSTGRES,datastores,  **Case Study:**  The event management company provides the platform for their customers to publish their events and manages all transactional processes. The ‘shop’ platform stores all orders(included historical datas) of a customer in a relational database and the DWH imports all those orders daily into their own PostgreSQL DB,PostgreS,318,326
18d35628866513a6c405cbae07bbbeb0,pin0kq,priyasweety1,https://www.reddit.com/r/dataengineering/comments/pin0kq/different_approaches_to_do_incremental_delta_load/,Different approaches to do incremental delta load in S3,POSTGRES,datastores,I have historical data as well as incremental data in s3 what’s the best efficient way to load and transform only incremental and load incremental data in Postgres or Redshift,Postgres,156,164
dc1190a9bb8bd529ebb2bffb1480dbfb,pgm25e,ApocalypseAce,https://www.reddit.com/r/dataengineering/comments/pgm25e/how_to_deal_with_db_performance/,How to deal with DB performance?,POSTGRES,datastores,"I'm using Postgresql as a datawarehouse for a small business, with relatively low data volumes",Postgres,11,19
aef6b2f1e9f41ed8885c2f9364e13658,pgm25e,ApocalypseAce,https://www.reddit.com/r/dataengineering/comments/pgm25e/how_to_deal_with_db_performance/,How to deal with DB performance?,POSTGRES,datastores,"Hardware is decent, running at least 4-6 cores at minimum at any one time, with up to 8GB+ of RAM available on demand for Postgres",Postgres,123,131
f9a2778edd82edb4c86be6f0fc99bed7,pgm25e,ApocalypseAce,https://www.reddit.com/r/dataengineering/comments/pgm25e/how_to_deal_with_db_performance/,How to deal with DB performance?,POSTGRES,datastores,Postgres won't cut it?,Postgres,1,9
2199ee7ab19f790dc2f373b6c69d0296,pgcq36,vinsanity1603,https://www.reddit.com/r/dataengineering/comments/pgcq36/aws_setup_recommendation_help/,AWS Setup Recommendation HELP,POSTGRES,datastores,"But my question is, can AWS Glue handle incremental load to a database like PostgreSQL or Redshift, as well as data modelling",PostgreS,77,85
d9e4da0e1788e0fc0392604f353a9377,pg8guw,vinsanity1603,https://www.reddit.com/r/dataengineering/comments/pg8guw/aws_setup_recommendation/,AWS Setup Recommendation,POSTGRES,datastores,"But my question is, can AWS Glue handle incremental load to a database like PostgreSQL or Redshift, as well as data modelling",PostgreS,77,85
94bc45d1cc2b7eaac585acb45169c0ad,pg8guw,vinsanity1603,https://www.reddit.com/r/dataengineering/comments/pg8guw/aws_setup_recommendation/,AWS Setup Recommendation,POSTGRES,datastores,"    For the OLAP System, I was thinking of just using an AWS RDS PostgreSQL for it",PostgreS,66,74
3c8e736f7b1c950f44fdf0907fd41dee,pg3d2h,MOONSfan,https://www.reddit.com/r/dataengineering/comments/pg3d2h/need_help_with_group_by_cube_function_in_redshift/,Need help with Group by Cube function in Redshift.,POSTGRES,datastores,"Hi all, I need help in doing postgres equivalent of group by cube in Redshift",postgres,30,38
65498d5ad5b53dee9b990117f75c77b9,pg3d2h,MOONSfan,https://www.reddit.com/r/dataengineering/comments/pg3d2h/need_help_with_group_by_cube_function_in_redshift/,Need help with Group by Cube function in Redshift.,POSTGRES,datastores,I can do this in postgres but the data size is too huge,postgres,18,26
807e428cad6b28788811caf037d80c57,pf86jp,OkieDaddy,https://www.reddit.com/r/dataengineering/comments/pf86jp/need_help_with_redshift/,Need help with Redshift pivoting/unpivoting/functions,POSTGRES,datastores,"In Postgres I can do it, albeit slowly, with a function that passes in the code value, and returns the code text",Postgres,4,12
55491f0c41127089ca939971718288cc,pskxx5,mdl003,https://www.reddit.com/r/dataengineering/comments/pskxx5/best_tools_for_metadata_capture_indexing_for/,Best tools for metadata capture + indexing for delta/parquet tables?,AMUNDSEN,data governance and registries,I've checked out [Amundsen.io](https://Amundsen.io,Amundsen,19,27
07bd6f06472cbb7396998d37c036c410,pryban,regreddit,https://www.reddit.com/r/dataengineering/comments/pryban/metadata_dictionary_software_for_small_teams/,Metadata Dictionary software for small teams?,AMUNDSEN,data governance and registries,"I've installed and semi-configured LinkedIn's Datahub and Lyfts Amundsen, and both were pretty complex to setup, and data discovery and ingestion is a very involved process in Amundsen, and only slightly easier in datahub",Amundsen,65,73
4c164e0066a46f58fcedc1390636769c,pryban,regreddit,https://www.reddit.com/r/dataengineering/comments/pryban/metadata_dictionary_software_for_small_teams/,Metadata Dictionary software for small teams?,AMUNDSEN,data governance and registries,"Amundsen literally requires almost a dedicated team to keep it running and any ingestion of metadata requires deep knowledge of the platform, which is very sparsely documented",Amundsen,1,9
f79a01983e004b156934e1719e5e7188,ppjtk8,Cloakie,https://www.reddit.com/r/dataengineering/comments/ppjtk8/amundsen_vs_datahub_vs/,Amundsen vs DataHub vs ???,AMUNDSEN,data governance and registries,"    I see that Amundsen has a long laundry list of adopters, but I find their documentation to be a little spotty and hard to read-through in comparison to DataHub",Amundsen,16,24
fa11f84b33318e4e7abfbce8429d7100,peap7h,CoMatrix1234,https://www.reddit.com/r/dataengineering/comments/peap7h/a_self_governing_data_gateway/,A self governing data gateway,AMUNDSEN,data governance and registries," Our ecosystem: AWS, Okta, S3, terraform, looking at Amundsen, Spark, cloud monitoring tools",Amundsen,54,62
06a83a0f7aea6c6d59d57678fa3ae80d,pryban,regreddit,https://www.reddit.com/r/dataengineering/comments/pryban/metadata_dictionary_software_for_small_teams/,Metadata Dictionary software for small teams?,DATAHUB,data governance and registries,"I've installed and semi-configured LinkedIn's Datahub and Lyfts Amundsen, and both were pretty complex to setup, and data discovery and ingestion is a very involved process in Amundsen, and only slightly easier in datahub",Datahub,47,54
ac5e434c7810a7e406f5f8c34bcb4fcd,pryban,regreddit,https://www.reddit.com/r/dataengineering/comments/pryban/metadata_dictionary_software_for_small_teams/,Metadata Dictionary software for small teams?,DATAHUB,data governance and registries,"Datahub would be perfect except it leaves a lot of components to the end user, like auth.",Datahub,1,8
7602d317c37e4232fb0a0f39f6b98a34,ppjtk8,Cloakie,https://www.reddit.com/r/dataengineering/comments/ppjtk8/amundsen_vs_datahub_vs/,Amundsen vs DataHub vs ???,DATAHUB,data governance and registries,"    I see that Amundsen has a long laundry list of adopters, but I find their documentation to be a little spotty and hard to read-through in comparison to DataHub",DataHub,157,164
069c60d121b57ae9cd7c26c903e0f00e,pli0og,MediumZealousideal29,https://www.reddit.com/r/dataengineering/comments/pli0og/skills_required/,Skills required,HDFS,file system,"I know SQL, hdfs, hive, control M..I also learned airflow, sqoop and basics of spark streaming, Kafka and AWS",hdfs,13,17
2926da14c5f8e008f59803f578d7744e,ph4fvj,WalrusWhich202,https://www.reddit.com/r/dataengineering/comments/ph4fvj/how_to_querying_data_faster/,How to Querying data faster,HDFS,file system," I've looked into spark, hadoop, cassandra, hdfs, and others",hdfs,45,49
39e1ba4ab3b3cc39890c186b5fa3c9b1,pgq50c,king_booker,https://www.reddit.com/r/dataengineering/comments/pgq50c/processing_different_file_format_data/,processing different file format data,HDFS,file system," It places the files in an hdfs location, which kafka picks up and does some processing over it and pushes it into hdfs in an RC file format",hdfs,28,32
66f98b18213081330f10581ed1c5c680,pgq50c,king_booker,https://www.reddit.com/r/dataengineering/comments/pgq50c/processing_different_file_format_data/,processing different file format data,HDFS,file system,"Is it better to read the json into a kafka topic, push it to hdfs as a json, create a hive external table with json serde and then convert it to parquet in other staging tables",hdfs,62,66
88d58d31f4a2f72e72589499c9c6b988,pgq50c,king_booker,https://www.reddit.com/r/dataengineering/comments/pgq50c/processing_different_file_format_data/,processing different file format data,HDFS,file system, Or should I push the data in some other file format in hdfs?,hdfs,57,61
bc4239e55b1d54d5e8519bf5d8b60824,pskxx5,mdl003,https://www.reddit.com/r/dataengineering/comments/pskxx5/best_tools_for_metadata_capture_indexing_for/,Best tools for metadata capture + indexing for delta/parquet tables?,AWS_S3,file system,Raw data is passed by the application to various Kafka topics where it's streamed into s3 buckets,s3,88,90
6ab75988d36472150a0a4a21a20755ce,psh63n,pineapplesoda1e-3,https://www.reddit.com/r/dataengineering/comments/psh63n/parquet_files/,Parquet files,AWS_S3,file system,What is the fastest way to read parquet file form S3 Bucket using Python?Should i stream file?Should i just use pandas?,S3,51,53
d82df81b0759494fa26a82febd36d131,pr6xg5,onelostsoul115,https://www.reddit.com/r/dataengineering/comments/pr6xg5/python_code_test_interview_general_career_advice/,Python Code Test (Interview) + general career advice,AWS_S3,file system,"file ingestion from S3 via Glue with some very basic spark transformations, very basic lamdbas etc",S3,21,23
f30aa20df02013798e9a5690335c123b,pq9f8b,noNSFWcontent,https://www.reddit.com/r/dataengineering/comments/pq9f8b/i_just_had_an_interview_with_a_senior_data/,"I just had an interview with a Senior Data Engineer and the head of the Data Science department of a company and they said, in the next interview they'd see how I think.",AWS_S3,file system,"We had a good conversation about my work experience which was not quite of a data engineer and my personal experience working with AWS tools such as EC2, Kinesis, Lambda, DynamoDB and S3",S3,185,187
44a85a4ecdfba80bc73264f864e7f347,pq4dma,britishbanana,https://www.reddit.com/r/dataengineering/comments/pq4dma/how_do_you_handle_data_versioning_for/,How do you handle data versioning for reproducibility?,AWS_S3,file system,"  We now have a need to start caching results from analyses on our analytical datasets in order to reduce the amount of some more expensive operations, but in order to reliably read from a cache (by cache I just mean a Delta table on S3",S3,235,237
b505ee7c11e0c0ef128ded1247cd6ae1,pq4dma,britishbanana,https://www.reddit.com/r/dataengineering/comments/pq4dma/how_do_you_handle_data_versioning_for/,How do you handle data versioning for reproducibility?,AWS_S3,file system," Alternatively I've thought about augmenting the Delta versioning / metadata with an external metadata store of some kind (another S3 file, or some persistent database), although the lack of transaction control across the metadata store and the data itself would make me sad",S3,132,134
11484114eb14735e28b6a0b59883b2f2,ppmc48,getafterit123,https://www.reddit.com/r/dataengineering/comments/ppmc48/spark_and_s3_integration/,Spark and S3 integration,AWS_S3,file system,Has anyone been able to connect spark 3.0+ to S3 object store using s3 connector or only s3a,S3,47,49
40e82418c67f1310032cd02fac4dd91f,ppmc48,getafterit123,https://www.reddit.com/r/dataengineering/comments/ppmc48/spark_and_s3_integration/,Spark and S3 integration,AWS_S3,file system,I heard somewhere that s3 connector was being depreciated in favor of s3a only in 3.0 and beyond due to s3a being more performant and supporting larger object sizes,s3,24,26
9343e0793a5e9eae86427c4e6a4f9f0c,ppmc48,getafterit123,https://www.reddit.com/r/dataengineering/comments/ppmc48/spark_and_s3_integration/,Spark and S3 integration,AWS_S3,file system,Would it be possible to used s3a on the Hadoop configuration on the client side but still connect to a s3://endpoint on the object storage side,s3,30,32
6fb4cb1e67522b2e672905c611cdf17d,plv523,Tropical_Wasp,https://www.reddit.com/r/dataengineering/comments/plv523/is_my_job_scope_too_broad_or_is_this_normal/,Is my job scope too broad? Or is this normal.,AWS_S3,file system, Over the last 18 months I have done the following:    Created a Python tool that auto uploads files from network drives and legacy on premise systems to AWS S3,AWS S3,155,161
1b2b8be8183ac4811883105f33d37ab4,plaxd7,77_65_61_73_65_6c,https://www.reddit.com/r/dataengineering/comments/plaxd7/what_it_skills_do_i_need_to_know_if_i_want_to_be/,What IT skills do I need to know if I want to be a data engineer?,AWS_S3,file system,"I have some experience with the basic services of AWS (EC2, S3, Batch, DynamoDB, etc",S3,61,63
b9abe0111b5a45c805633363edb38a0e,pl9n2x,DatKalvin,https://www.reddit.com/r/dataengineering/comments/pl9n2x/is_this_architecture_cost_effective_performant/,Is this Architecture cost effective &amp; performant? What's your suggestion.,AWS_S3,file system,stream to S3 in parquet format using AWS Database Migration Service as new records becomes available,S3,11,13
4c4fa70831d6e1658138a800cef0d795,pl9n2x,DatKalvin,https://www.reddit.com/r/dataengineering/comments/pl9n2x/is_this_architecture_cost_effective_performant/,Is this Architecture cost effective &amp; performant? What's your suggestion.,AWS_S3,file system,"Then Snowpipe picks up data from S3 based on event notification from S3, put in a queue and load to Snowflake data warehouse in a stream format",S3,34,36
9008558cc82c39132986a2f8989dea69,pktcp3,noNSFWcontent,https://www.reddit.com/r/dataengineering/comments/pktcp3/can_someone_help_me_understand_the_difference/,Can someone help me understand the difference between the the docker-compose files?,AWS_S3,file system,"   **The first docker compose file is  -**           version: '3.9'               #asking for a postgres database     services:       postgres:         image: postgres:9.6         environment:           - POSTGRES_USER=airflow           - POSTGRES_PASSWORD=airflow           - POSTGRES_DB=airflow         logging:           options:             max-size: 10m             max-file: 3               #asking for a webserver       webserver:         build: ./dockerfiles         restart: always         depends_on:           - postgres         environment:           - LOAD_EX=n           - EXECUTOR=Local         logging:           options:             max-size: 10m             max-file: 3         volumes:           - ./dags:/usr/local/airflow/dags           # - ./plugins:/usr/local/airflow/plugins         ports:           - 8080:8080         command: webserver         healthcheck:           test: [CMD-SHELL, [ -f /usr/local/airflow/airflow-webserver.pid ]]           interval: 30s           timeout: 30s           retries: 3   For the above docker compose file, the dockerfiles folder had Dockerfile with the following text -       FROM puckel/docker-airflow          RUN pip install requests     RUN pip install pandas  **The second docker compose file is -**         version: '3'     services:       postgres:         image: postgres:9.6         environment:           - POSTGRES_USER=airflow           - POSTGRES_PASSWORD=airflow           - POSTGRES_DB=airflow         ports:           - 5432:5432            webserver:         image: puckel/docker-airflow:1.10.1         build:           context: https://github.com/puckel/docker-airflow.git#1.10.1           dockerfile: Dockerfile           args:             AIRFLOW_DEPS: gcp_api,s3             PYTHON_DEPS: sqlalchemy==1.2.0         restart: always         depends_on:           - postgres         environment:           - LOAD_EX=n           - EXECUTOR=Local           - FERNET_KEY=jsDPRErfv8Z_eVTnGfF8ywd19j4pyqE3NpdUBA_oRTo=         volumes:           - ./examples/intro-example/dags:/usr/local/airflow/dags           # Uncomment to include custom plugins           # - ./plugins:/usr/local/airflow/plugins         ports:           - 8080:8080         command: webserver         healthcheck:           test: [CMD-SHELL, [ -f /usr/local/airflow/airflow-webserver.pid ]]           interval: 30s           timeout: 30s           retries: 3       When the second docker compose was stuck in a dependency hell, I noticed both were pulling the same Airflow puckel image",s3,1742,1744
3ab80c98be480b5f417f2f87ebecd6cb,pkmggc,datanoob2021,https://www.reddit.com/r/dataengineering/comments/pkmggc/streaming_pipeline_question/,Streaming Pipeline Question,AWS_S3,file system, I know AWS has tools like step functions but I was hoping to use some free tools like GreatExpectations and other libraries to check data before sending it over to Firehose/S3/Redshift.,S3,175,177
6fa85c5f5ddb0183b492544d6cbbddd3,pin0kq,priyasweety1,https://www.reddit.com/r/dataengineering/comments/pin0kq/different_approaches_to_do_incremental_delta_load/,Different approaches to do incremental delta load in S3,AWS_S3,file system,I have historical data as well as incremental data in s3 what’s the best efficient way to load and transform only incremental and load incremental data in Postgres or Redshift,s3,55,57
911f1648d736e0c9640f42a646a78eaa,pie34a,umarcja,https://www.reddit.com/r/dataengineering/comments/pie34a/storing_json_logs_in_aws_for_querying/,Storing JSON logs in AWS for querying,AWS_S3,file system, I'm using an S3 bucket to store the raw logs files at the moment and trying to figure out what's the best way to store those logs,S3,15,17
f02d31e77760bfe5084f912b95d24604,pi70aq,h2otoo_frog,https://www.reddit.com/r/dataengineering/comments/pi70aq/is_boomi_as_bad_as_it_seems/,Is Boomi as bad as it seems?,AWS_S3,file system," It just took me a week to write something that would make a basic API call, loop through the pages, save to AWS S3, then send a command to the database for loading",AWS S3,110,116
5766105910ca375637cfc554061d35eb,pgcq36,vinsanity1603,https://www.reddit.com/r/dataengineering/comments/pgcq36/aws_setup_recommendation_help/,AWS Setup Recommendation HELP,AWS_S3,file system,"Hi, I have an application that will dump json data to an object storage (probably S3",S3,83,85
1339ed1a942a3a9bf48af156fe57679a,pg8guw,vinsanity1603,https://www.reddit.com/r/dataengineering/comments/pg8guw/aws_setup_recommendation/,AWS Setup Recommendation,AWS_S3,file system,"Hi, I have an application that will dump json data to an object storage (probably S3",S3,83,85
a6b13e1e3fa84e7e5a3a4c4cd84a72d6,pfxupg,Initial_Squirrel2693,https://www.reddit.com/r/dataengineering/comments/pfxupg/what_does_aws_coding_round_consist_usually/,What does AWS coding round consist usually?,AWS_S3,file system," The services mentioned in my Resume are S3, Redshift, Lambda, ElasticSearch, EC2, etc",S3,42,44
e1beb76dd5f5442a49f5e9b40e6046d7,pfic3r,LinaVak,https://www.reddit.com/r/dataengineering/comments/pfic3r/newbie_question_on_s3/,Newbie question on s3,AWS_S3,file system,I have never used s3 before,s3,19,21
