KEYWORD_SENTENCE_ID,POST_ID,AUTHOR,URL,TITLE,KEYWORD,KEYWORD_CATEGORY,SENTENCE_TEXT,MATCH_SUBSTRING,START_POSITION,END_POSITION
264aba353d9cbe63ba7dfee0002a809c,pdni20,sedition8,https://www.reddit.com/r/dataengineering/comments/pdni20/spark_design_patterns/,Spark Design Patterns,APACHE_SPARK,analytics,I know that the company I'm applying to uses spark for stream processing and asks questions based on their current infra,spark,46,51
331d47df667fc8d9c36fa86069f6ac91,pdni20,sedition8,https://www.reddit.com/r/dataengineering/comments/pdni20/spark_design_patterns/,Spark Design Patterns,APACHE_SPARK,analytics,   I'm looking for resources that show how Spark would get integrated with an end to end system,Spark,44,49
a7cf2d02457b94ea922262f474e92d52,pdni20,sedition8,https://www.reddit.com/r/dataengineering/comments/pdni20/spark_design_patterns/,Spark Design Patterns,APACHE_SPARK,analytics,Spark receives data from Kafka queues 2,Spark,1,6
2a5ef48dccb479d2ccdcb943b1ff8b3d,pdni20,sedition8,https://www.reddit.com/r/dataengineering/comments/pdni20/spark_design_patterns/,Spark Design Patterns,APACHE_SPARK,analytics,Spark aggregates the data,Spark,1,6
880bbc1c6869ed33835734cefc688e85,pdka0i,HighlyIllogicall,https://www.reddit.com/r/dataengineering/comments/pdka0i/creating_analytical_layer_using_spark_on_top_of/,Creating analytical layer using Spark on top of Parquet files,APACHE_SPARK,analytics,"Hello,  I am trying to build an analytical layer using Spark I am still in the planning stage, the idea is we want to try new technologies within my team to see the potentials of such technology",Spark,56,61
27f002a4786e7bcb734fc10264daa6c9,pdka0i,HighlyIllogicall,https://www.reddit.com/r/dataengineering/comments/pdka0i/creating_analytical_layer_using_spark_on_top_of/,Creating analytical layer using Spark on top of Parquet files,APACHE_SPARK,analytics," so, the source system is a SQL server system:   \- I am thinking of pulling all the data in a parquet format using Nifi    \- Using spark I am gonna create tables/views out of the parquet files  \- connect Power BI and other visualization tools to Spark views/tables  However my concern is:  \- How to update parquet files whenever there are changes in the source",spark,134,139
dd4a47c7b76802e9a39b9f7b4080c305,pdka0i,HighlyIllogicall,https://www.reddit.com/r/dataengineering/comments/pdka0i/creating_analytical_layer_using_spark_on_top_of/,Creating analytical layer using Spark on top of Parquet files,APACHE_SPARK,analytics, \- will it be better to read directly from SQL tables and update the spark fact/dim tables,spark,71,76
24d7075b8bbc2d461e5651461b254214,pdka0i,HighlyIllogicall,https://www.reddit.com/r/dataengineering/comments/pdka0i/creating_analytical_layer_using_spark_on_top_of/,Creating analytical layer using Spark on top of Parquet files,APACHE_SPARK,analytics,what made me consider parquet format is the fact that it is recommended by spark to be used.,spark,76,81
689acd5f4852679dbec4b922aa61facd,pdejm8,Simonaque,https://www.reddit.com/r/dataengineering/comments/pdejm8/career_advice_unsure_if_i_should_pursue_a_masters/,Career Advice: Unsure if I should pursue a Master's of Computer Science since I have a non-technical Undergraduate Degree.,APACHE_SPARK,analytics,"Business Analyst - Certificates: AWS CCP, AWS DAS, DB Spark Developer, MCAF, Gitlab Assoc",Spark,55,60
1abe416961a88d382a20443774902dd9,pctg6h,statistically_broke,https://www.reddit.com/r/dataengineering/comments/pctg6h/parquet_row_group_indexing/,Parquet Row Group ""Indexing"",APACHE_SPARK,analytics," For reference, using primarily Pyspark on Azure Databricks and processing from a Data Lake to a Delta Lake",spark,35,40
582adeb5f1e3527204623cdf85efeec6,pcrlzi,Professional_Crazy49,https://www.reddit.com/r/dataengineering/comments/pcrlzi/confused_about_de_vs_sde/,Confused about DE vs SDE,APACHE_SPARK,analytics," The Confusion:  So one of my friends works as a software engineer 1 and he has worked with kafka, docker, aws, prometheus, spark",spark,125,130
f4fd84c11f304686c426e598b263575d,pcokrh,dathu9,https://www.reddit.com/r/dataengineering/comments/pcokrh/is_dbt_can_be_used_at_the_enterprise_level/,is dbt can be used at the enterprise level?,APACHE_SPARK,analytics,Can dbt read the data from s3 without EMR cluster (Spark cluster,Spark,52,57
ea0add59ccfb43574845e497f16099e3,pceu26,skpfm_06,https://www.reddit.com/r/dataengineering/comments/pceu26/been_working_in_a_small_startup_for_almost_2/,"Been working in a small startup for almost 2 years doing pretty much everything on the engineering side, what should I focus on and pursue moving forward?",APACHE_SPARK,analytics,"Because I was doing most of these solo for so long, I haven't had the chance to delve deeper into a subset of these tasks, so I am not familiar with tools like Luigi, Airflow, Kubernetes, Deeper understanding of AWS services, writing python like they do in Open Source libraries, Hadoop, Spark, etc",Spark,289,294
a0215b3f431955ee4b8b2eb06d153278,pc6jwg,eddygaras,https://www.reddit.com/r/dataengineering/comments/pc6jwg/moving_away_from_ssis/,Moving away from SSIS,APACHE_SPARK,analytics,Or using python and frameworks like Airflow and Spark or some others,Spark,49,54
ed2e4e77668c194572e90adc5c6a4b3d,pt0vhk,pineapplesoda1e-3,https://www.reddit.com/r/dataengineering/comments/pt0vhk/parquet_files/,parquet files,APACHE_PARQUET,formats,"Hey, i have parquet files where each column is a pixel value of a image,i want to feed my pytorch model,should i directly extract each row as image from parquet file?I wanted to make each row a pickle file which i will feed to model",parquet,13,20
34893799c2bdf6405d7608b959c28ee4,pskxx5,mdl003,https://www.reddit.com/r/dataengineering/comments/pskxx5/best_tools_for_metadata_capture_indexing_for/,Best tools for metadata capture + indexing for delta/parquet tables?,APACHE_PARQUET,formats,"What tools are out there that can automate column value testing, metadata capture, and indexing at scale for columns in delta/parquet tables",parquet,127,134
4275b1ee07697db8434886655122cf10,psh63n,pineapplesoda1e-3,https://www.reddit.com/r/dataengineering/comments/psh63n/parquet_files/,Parquet files,APACHE_PARQUET,formats,What is the fastest way to read parquet file form S3 Bucket using Python?Should i stream file?Should i just use pandas?,parquet,33,40
761c501a1d17de479a1bac3d4691e555,pl9n2x,DatKalvin,https://www.reddit.com/r/dataengineering/comments/pl9n2x/is_this_architecture_cost_effective_performant/,Is this Architecture cost effective &amp; performant? What's your suggestion.,APACHE_PARQUET,formats,stream to S3 in parquet format using AWS Database Migration Service as new records becomes available,parquet,17,24
f0d8448c6677c98d8a758252f6ec2ef9,pjt56n,gamecockguy2003,https://www.reddit.com/r/dataengineering/comments/pjt56n/best_way_to_get_snapshotfull_dataset_from_changes/,Best way to get snapshot/full dataset from changes,APACHE_PARQUET,formats,"My goal is to create a representation of the full set of that domain data based on those changes, with the output being something like a parquet file (though this is flexible",parquet,138,145
2e4fd53802e70d6308a5d274cf355533,pjsuu8,Irmodude2003,https://www.reddit.com/r/dataengineering/comments/pjsuu8/best_way_to_get_snapshotfull_dataset_from_changes/,Best way to get snapshot/full dataset from changes,APACHE_PARQUET,formats,"My goal is to create a representation of the full set of that domain data based on those changes, with the output being something like a parquet file (though this is flexible",parquet,138,145
3716524982a15076e0cd57515a85d730,pie34a,umarcja,https://www.reddit.com/r/dataengineering/comments/pie34a/storing_json_logs_in_aws_for_querying/,Storing JSON logs in AWS for querying,APACHE_PARQUET,formats," I thought of using the Parquet format as it's small and powerful, and this format will allow me to filter base on one column easily, but the problem is that I need to provide the raw file in the end",Parquet,25,32
c8bdb03b0453d9f9abc89cc828da75d7,pie34a,umarcja,https://www.reddit.com/r/dataengineering/comments/pie34a/storing_json_logs_in_aws_for_querying/,Storing JSON logs in AWS for querying,APACHE_PARQUET,formats,Is it completely wrong to use Parquet and have a column that stores raw JSON logs,Parquet,31,38
90f96572421e44310e2b25cc2f111588,pie34a,umarcja,https://www.reddit.com/r/dataengineering/comments/pie34a/storing_json_logs_in_aws_for_querying/,Storing JSON logs in AWS for querying,APACHE_PARQUET,formats, I thought of Athena to query Parquet files or dump raw logs in Elasticsearch,Parquet,31,38
9d3c296f12c0f2198affa3cfb514873e,pgq50c,king_booker,https://www.reddit.com/r/dataengineering/comments/pgq50c/processing_different_file_format_data/,processing different file format data,APACHE_PARQUET,formats,Which is later converted into parquet tables in hive,parquet,31,38
7297d1ca5b3226a4fa0e6b33c410b020,pgq50c,king_booker,https://www.reddit.com/r/dataengineering/comments/pgq50c/processing_different_file_format_data/,processing different file format data,APACHE_PARQUET,formats,"Is it better to read the json into a kafka topic, push it to hdfs as a json, create a hive external table with json serde and then convert it to parquet in other staging tables",parquet,146,153
3a6eff8d81295cd9659124c425950f6e,pfv18d,Godmons,https://www.reddit.com/r/dataengineering/comments/pfv18d/spark_jobs_should_we_define_schema_on_read/,Spark Jobs : Should we define schema on read ?,APACHE_PARQUET,formats,"Hi guys,     When importing a dataframe from parquet or other file format in spark, we can either infer or specify the schema (data types",parquet,46,53
3be2f85162c11c2b7d5ffc0412cffec4,peieca,Ok-Sentence-8542,https://www.reddit.com/r/dataengineering/comments/peieca/how_do_you_guys_validate_your_data_how_does_your/,"How do you guys validate your data? How does your process look like and which tools are you using? Our main Stack: Databricks, Azure Datafactory, Data Lake",APACHE_PARQUET,formats,We are using databricks and azure data lake and would like to test our parquet files against expectations such as:  &amp;#x200B;      Pipeline fails if:      - customerId null or customerId is not unique     -  productPrice is smaller or equal to 0     - ,parquet,72,79
dce554c7f5fb8e093aba3dd6ba1cf460,pe9f42,TiDuNguyen,https://www.reddit.com/r/dataengineering/comments/pe9f42/purely_columnar_database_suggestion/,Purely columnar database suggestion,APACHE_PARQUET,formats,"My usecase requires it to  * optimize on read/add/remove columns * scale well with column number  * ease of use/maintenance, something as easy to read by columns as a `parquet` file but also support updating by columns",parquet,169,176
9355734ccfe8fa0fecc800041ebbc660,pdka0i,HighlyIllogicall,https://www.reddit.com/r/dataengineering/comments/pdka0i/creating_analytical_layer_using_spark_on_top_of/,Creating analytical layer using Spark on top of Parquet files,APACHE_PARQUET,formats," so, the source system is a SQL server system:   \- I am thinking of pulling all the data in a parquet format using Nifi    \- Using spark I am gonna create tables/views out of the parquet files  \- connect Power BI and other visualization tools to Spark views/tables  However my concern is:  \- How to update parquet files whenever there are changes in the source",parquet,96,103
ef37ed5046791441bd8952fd73843da0,pdka0i,HighlyIllogicall,https://www.reddit.com/r/dataengineering/comments/pdka0i/creating_analytical_layer_using_spark_on_top_of/,Creating analytical layer using Spark on top of Parquet files,APACHE_PARQUET,formats,what made me consider parquet format is the fact that it is recommended by spark to be used.,parquet,23,30
c76b749ac79790fb56463f0ecbb5849e,pctg6h,statistically_broke,https://www.reddit.com/r/dataengineering/comments/pctg6h/parquet_row_group_indexing/,Parquet Row Group ""Indexing"",APACHE_PARQUET,formats,"Posted this in another subreddit as well, but figured would cast my net wider since this is a bit niche:   I'm not what you would call *the best* or *most knowledgeable* on Parquet files, but I recently came across their file structure and was wondering",Parquet,174,181
e3a16198ca00323db4b4af3dc1bc8535,pctg6h,statistically_broke,https://www.reddit.com/r/dataengineering/comments/pctg6h/parquet_row_group_indexing/,Parquet Row Group ""Indexing"",APACHE_PARQUET,formats, Desired use case: filter out already processed row groups from a parquet file to limit the amount of data kept for downstream merging with existing tables,parquet,67,74
50db3bb9ba798866f79a3ac7cc48589b,pctg6h,statistically_broke,https://www.reddit.com/r/dataengineering/comments/pctg6h/parquet_row_group_indexing/,Parquet Row Group ""Indexing"",APACHE_PARQUET,formats,Grab IngestionParquetFile from Data Lake,Parquet,15,22
8f40ed33896438612b33533a642f9ea1,pctg6h,statistically_broke,https://www.reddit.com/r/dataengineering/comments/pctg6h/parquet_row_group_indexing/,Parquet Row Group ""Indexing"",APACHE_PARQUET,formats,Save Filtered new Row Groups as UpdatesParquetFile,Parquet,40,47
40b160ec20a67e14bd19a212c8d5106d,pctg6h,statistically_broke,https://www.reddit.com/r/dataengineering/comments/pctg6h/parquet_row_group_indexing/,Parquet Row Group ""Indexing"",APACHE_PARQUET,formats,Save the list of Row Group Checksums in the UpdatesParquetFile to keep track of processing them to the database,Parquet,52,59
873fab636746bb580e99249b4da604cc,pctg6h,statistically_broke,https://www.reddit.com/r/dataengineering/comments/pctg6h/parquet_row_group_indexing/,Parquet Row Group ""Indexing"",APACHE_PARQUET,formats,downstream processing of the much smaller UpdatesParquetFile.,Parquet,50,57
2419defc2c6b244ab297a4d757ded594,pcav10,Integrator_Eye,https://www.reddit.com/r/dataengineering/comments/pcav10/changing_column_data_type_on_large_hive_tables/,Changing column data type on large hive tables,APACHE_PARQUET,formats,There are more than 250+ tables defined using parquet format and having 1000+ partitions,parquet,47,54
04fb7da8391d0cdaf4e7f70ff7b488b4,ptdg0g,diegoelmestre,https://www.reddit.com/r/dataengineering/comments/ptdg0g/improvements_to_my_first_de_project_streaming/,Improvements to my first DE (?) project (Streaming Datawarehouse). What's next?,KAFKA_CONNECT,integration,    1 - We have a Kafka Connect running that grabs the changes from our MongoDB collections,Kafka Connect,19,32
a67d7ec97f42fbc3cf9b03295f7912ee,ph15au,SukalpVashishtha,https://www.reddit.com/r/dataengineering/comments/ph15au/microservice_shared_database_antipattern_question/,Microservice shared database antipattern question,APACHE_KAFKA_STREAMS,stream processing,  Is it a fair design pattern that a stream processing framework (spark/kafka streams etc,kafka streams,73,86
3e3731ca66080001e5a1b0bb2497b048,ps0h44,scraper01,https://www.reddit.com/r/dataengineering/comments/ps0h44/is_anyone_here_still_using_apache_storm/,Is anyone here still using Apache Storm?,APACHE_STORM,stream processing,Wondering if anyone here prefers Storm above other stream frameworks like Flink and why.,Storm,34,39
8dcb3c13ee75324208f0234a963930df,pqty5b,scraper01,https://www.reddit.com/r/dataengineering/comments/pqty5b/stream_processing_tool_to_pair_with_kafka/,Stream processing tool to pair with Kafka,APACHE_STORM,stream processing,"Between spark streaming, apache flink and apache storm, what do you think sinergizes the best with Kafka",apache storm,43,55
57720113fc51d4c1da327528d5ce7ed1,po6zh0,Nervous-Chain-5301,https://www.reddit.com/r/dataengineering/comments/po6zh0/aws_managed_airflow_or_aws_sam_for_simple_etls/,AWS Managed Airflow or AWS SAM for Simple ETLs,APACHE_STORM,stream processing,"We are planning on ingesting data sources that do not have a native Fivetran connector, and I am brainstorming the best approach",storm,103,108
7f79c7a4beb0b5630ea5736f1bcb824a,po5kgw,marcosmarxm,https://www.reddit.com/r/dataengineering/comments/po5kgw/presentation_airbyte_airflow_on_gcp/,Presentation: Airbyte + Airflow on GCP,APACHE_STORM,stream processing,You can register for the Livestorm session here: [https://airbyte.io/weekly-office-hours](https://airbyte.io/weekly-office-hours?utm_content=buffer52018&amp;utm_medium=social&amp;utm_source=linkedin.com&amp;utm_campaign=buffer,storm,30,35
cff8496d9cd496d7625e7757ed718ca7,ptfb2d,redditthrowaway0315,https://www.reddit.com/r/dataengineering/comments/ptfb2d/does_airflow_provide_a_functionality_to_remove/,Does Airflow provide a functionality to remove historical data created by previous runs of a DAG?,APACHE_AIRFLOW,workflow management,I can clear previous runs and Airflow will schedule re-runs but the re-runs do NOT remove historical data,Airflow,31,38
d1dbdd0b6b486283e4c46fcd9f3cccaf,ptfb2d,redditthrowaway0315,https://www.reddit.com/r/dataengineering/comments/ptfb2d/does_airflow_provide_a_functionality_to_remove/,Does Airflow provide a functionality to remove historical data created by previous runs of a DAG?,APACHE_AIRFLOW,workflow management,It looks like the only way to do it properly is to:  * Pause DAG in Airflow UI * Manually DELETE all data of previous 60 days * Manually run the new script and INSERT data for the past 60 days * Unpause the DAG  However this is error-prone and can be tricky to implement if say I want to re-run the previous 48 hour data for an hourly process (so that I really need to be careful where to cut the data,Airflow,69,76
54836da2a7e20d4a49ffd68ce1b5e6a7,ptfb2d,redditthrowaway0315,https://www.reddit.com/r/dataengineering/comments/ptfb2d/does_airflow_provide_a_functionality_to_remove/,Does Airflow provide a functionality to remove historical data created by previous runs of a DAG?,APACHE_AIRFLOW,workflow management,"If everytime I cleared a run, Airflow can run a script in background (e.g",Airflow,31,38
123dc34b6c4eea8cceba647de9965df5,ptfb2d,redditthrowaway0315,https://www.reddit.com/r/dataengineering/comments/ptfb2d/does_airflow_provide_a_functionality_to_remove/,Does Airflow provide a functionality to remove historical data created by previous runs of a DAG?,APACHE_AIRFLOW,workflow management,  Is there a way to do this in Airflow?,Airflow,32,39
4f66054164634198657e94aab6b5b252,ptdg0g,diegoelmestre,https://www.reddit.com/r/dataengineering/comments/ptdg0g/improvements_to_my_first_de_project_streaming/,Improvements to my first DE (?) project (Streaming Datawarehouse). What's next?,APACHE_AIRFLOW,workflow management,"Be free to suggest new techs (Sparks, Airflows, or even other GCP components (dataflow p.e.), I'm willing to learn it  &amp;#x200B;  &amp;#x200B;  https://preview.redd.it/lyap4qggf3p71.png?width=735&amp;format=png&amp;auto=webp&amp;s=fedf64446f22a27f195f172e653c7160a3295da6  Feel free to ask for more information",Airflow,39,46
18fda7878779b857a0b7599bed3caeba,ptceyv,kristiclimbs,https://www.reddit.com/r/dataengineering/comments/ptceyv/airflow_externaltasksensor_proper_way_to_use_for/,Airflow - ExternalTaskSensor-&gt; proper way to use for subdag task,APACHE_AIRFLOW,workflow management,"Hello,  I'm having difficulty figuring out how to use the ExternalTaskSensor for Airflow",Airflow,82,89
a3655d2212e7e138fba003f8389fce76,ptceyv,kristiclimbs,https://www.reddit.com/r/dataengineering/comments/ptceyv/airflow_externaltasksensor_proper_way_to_use_for/,Airflow - ExternalTaskSensor-&gt; proper way to use for subdag task,APACHE_AIRFLOW,workflow management,and the Airflow slack channel but I haven't received a response,Airflow,9,16
0c958b08d788892b3a3d756c015a753a,psryjw,Assi6,https://www.reddit.com/r/dataengineering/comments/psryjw/tips_and_useful_websitecourses_to_get_into_data/,Tips and useful website/courses to get into data engineering?,APACHE_AIRFLOW,workflow management,I know a bit of Airflow but zero knowledge about cloud things (AWS for example,Airflow,17,24
a20a54a63c56023395c06b23e8251418,psntnd,honorchan1,https://www.reddit.com/r/dataengineering/comments/psntnd/tutorial_monitoring_airflow_with_prometheus/,"Tutorial: Monitoring Airflow with Prometheus, StatsD and Grafana",APACHE_AIRFLOW,workflow management,"In this post, Vova guides you through how to build an open-source Airflow monitoring solution that helps you visualize Airflow cluster metrics",Airflow,67,74
956b054151cc6ea680bc7bf0c36f864b,psntnd,honorchan1,https://www.reddit.com/r/dataengineering/comments/psntnd/tutorial_monitoring_airflow_with_prometheus/,"Tutorial: Monitoring Airflow with Prometheus, StatsD and Grafana",APACHE_AIRFLOW,workflow management,"If you've ever wanted to configure an [**open source data observability dashboard**](https://databand.ai/blog/everyday-data-engineering-monitoring-airflow-with-prometheus-statsd-and-grafana/?utm_source=forum&amp;utm_medium=r&amp;utm_group=de), we think you'll find this useful",airflow,148,155
50236673b76367095ffdeebfe83e627f,pskxx5,mdl003,https://www.reddit.com/r/dataengineering/comments/pskxx5/best_tools_for_metadata_capture_indexing_for/,Best tools for metadata capture + indexing for delta/parquet tables?,APACHE_AIRFLOW,workflow management,From there we transform the raw data and insert it into delta tables using Databricks jobs orchestrated by Airflow,Airflow,108,115
7373c4c2b7f1939fe45fbfe8e9f7eb10,prp2nd,Ok-Message1053,https://www.reddit.com/r/dataengineering/comments/prp2nd/how_can_i_write_my_pipeline_to_execute_only/,how can I write my pipeline to execute only certain tasks?,APACHE_AIRFLOW,workflow management,"I know Airflow exists, but I'm not sure if that would work for me because I am only creating a VM and starting my container on command, so I don't have an environment for Airflow to constantly be running in",Airflow,8,15
e47e4876f198a58e334750a0dfa265f4,preqiw,m_usamahameed,https://www.reddit.com/r/dataengineering/comments/preqiw/cdc_implementation_in_airflow/,CDC implementation in Airflow.,APACHE_AIRFLOW,workflow management,How can we implement CDC in Airflow using Mysql or Python Operator,Airflow,29,36
9e8ef2ad957e683eaef3f885c668443c,pr6xg5,onelostsoul115,https://www.reddit.com/r/dataengineering/comments/pr6xg5/python_code_test_interview_general_career_advice/,Python Code Test (Interview) + general career advice,APACHE_AIRFLOW,workflow management,"Their tech stack is as follows:  SQL, Python, Clojure, Scala, AWS:Glue, Athena, Redshift, Apache Airflow, Kafka, Spark, Terraform  I'm a bit worried about the Python code test as my day to day and expertise is still mainly in pl/sql and pl/pgsql, so I need to brush up on my Python",Apache Airflow,91,105
4e9b3a9f3edb5f0e534301723e626e80,pqty5b,scraper01,https://www.reddit.com/r/dataengineering/comments/pqty5b/stream_processing_tool_to_pair_with_kafka/,Stream processing tool to pair with Kafka,APACHE_AIRFLOW,workflow management,"So far i've learnt Spark for big data ETL, a bit of Big Query for ELT, Apache Airflow for small data ETL,  and at last Kafka as a message passing queue",Apache Airflow,72,86
609387401a00e721110601e570f4d8bd,pqeipn,QuaternionHam,https://www.reddit.com/r/dataengineering/comments/pqeipn/standardbest_ways_of_moving_data_between_databases/,Standard/Best ways of moving data between Databases,APACHE_AIRFLOW,workflow management,All of this using Airflow as orchestrator,Airflow,19,26
f687ad7d0e28ed7a227fbdf06bf41588,pqeipn,QuaternionHam,https://www.reddit.com/r/dataengineering/comments/pqeipn/standardbest_ways_of_moving_data_between_databases/,Standard/Best ways of moving data between Databases,APACHE_AIRFLOW,workflow management, &amp;#x200B;  I thought of creating a custom python function that gets data from Postgre (using the correspondent airflow hook,airflow,116,123
36001bd7cf8f468b8969d807b8a0fb34,pphbrg,NotACardassian,https://www.reddit.com/r/dataengineering/comments/pphbrg/docker_environments_and_best_practices_in/,Docker environments and best practices in Industry question,APACHE_AIRFLOW,workflow management,I’m really struggling to wrap my head around industry best practice for an airflow workflow,airflow,76,83
280d97fc6051c8ab24c36c94f40dddc6,pphbrg,NotACardassian,https://www.reddit.com/r/dataengineering/comments/pphbrg/docker_environments_and_best_practices_in/,Docker environments and best practices in Industry question,APACHE_AIRFLOW,workflow management,  So say I have a docker container that runs airflow,airflow,46,53
111cbbc123987cc76771740c57fd1254,pphbrg,NotACardassian,https://www.reddit.com/r/dataengineering/comments/pphbrg/docker_environments_and_best_practices_in/,Docker environments and best practices in Industry question,APACHE_AIRFLOW,workflow management,Should any additional packages I might use in my airflow script be installed in the python virtual environment inside the container,airflow,50,57
2832c94c708bf83bd17630fbb7929569,pphbrg,NotACardassian,https://www.reddit.com/r/dataengineering/comments/pphbrg/docker_environments_and_best_practices_in/,Docker environments and best practices in Industry question,APACHE_AIRFLOW,workflow management,Or would I setup a second virtual environment inside or outside the docker container so airflow dependencies don’t mess with etl script dependencies where I may want something like the latest version of pandas,airflow,89,96
168252622ab6767802ae1308d52492c1,po8y8l,honorchan1,https://www.reddit.com/r/dataengineering/comments/po8y8l/airflows_best_kept_secrets_how_to_track_metadata/,Airflow's Best Kept Secrets: How To Track Metadata With Airflow Cluster Policies &amp; Task Callbacks,APACHE_AIRFLOW,workflow management,"Databand.ai Senior Software Engineer, Jonathan Barda, recently penned a [**tutorial on how to track metadata using Airflow's cluster policies and task callbacks**](https://databand.ai/blog/how-to-track-metadata-with-airflow-cluster-policies-task-callbacks/?utm_source=forum&amp;utm_medium=r&amp;utm_group=de",Airflow,116,123
