KEYWORD_SENTENCE_ID,POST_ID,AUTHOR,URL,TITLE,KEYWORD,KEYWORD_CATEGORY,SENTENCE_TEXT,MATCH_SUBSTRING,START_POSITION,END_POSITION
821f3985bec701dc0b4f4e7e6dbfccfb,peap7h,CoMatrix1234,https://www.reddit.com/r/dataengineering/comments/peap7h/a_self_governing_data_gateway/,A self governing data gateway,AWS_S3,file system," Our ecosystem: AWS, Okta, S3, terraform, looking at Amundsen, Spark, cloud monitoring tools",S3,28,30
e516b9bdb8856b359e35017fb738a001,pdflom,Ajudada,https://www.reddit.com/r/dataengineering/comments/pdflom/how_to_change_career_from_it_operations_to/,How to change career from IT operations to development field? (Please read description),AWS_S3,file system,"I have good programming skills and basic AWS skills (S3, Athena, EMR, Glue",S3,54,56
9543778450fdcd539c978176cea07e29,pcokrh,dathu9,https://www.reddit.com/r/dataengineering/comments/pcokrh/is_dbt_can_be_used_at_the_enterprise_level/,is dbt can be used at the enterprise level?,AWS_S3,file system,Can dbt read the data from s3 without EMR cluster (Spark cluster,s3,28,30
7322ac401128d6a9bd1a2a88ff3c6038,pcokrh,dathu9,https://www.reddit.com/r/dataengineering/comments/pcokrh/is_dbt_can_be_used_at_the_enterprise_level/,is dbt can be used at the enterprise level?,AWS_S3,file system,Can dbt store the output to s3 or onedrive storage?,s3,29,31
8816214a4005bd2ad72794eaadb8c29f,pceu26,skpfm_06,https://www.reddit.com/r/dataengineering/comments/pceu26/been_working_in_a_small_startup_for_almost_2/,"Been working in a small startup for almost 2 years doing pretty much everything on the engineering side, what should I focus on and pursue moving forward?",AWS_S3,file system,Design how things should be stored on S3,S3,39,41
d39c4ec215c8ce0514e59172db1f3188,pcbds8,the_travelo_,https://www.reddit.com/r/dataengineering/comments/pcbds8/what_exactly_does_schema_on_read_mean_in_a_data/,What exactly does ""Schema on Read"" mean in a Data Lake?,AWS_S3,file system,"S3, they have automated parametrized scripts that enforce schemas, data types, etc",S3,1,3
1840f0da99557c63c9ca7e7db2bbdbd9,pcbds8,the_travelo_,https://www.reddit.com/r/dataengineering/comments/pcbds8/what_exactly_does_schema_on_read_mean_in_a_data/,What exactly does ""Schema on Read"" mean in a Data Lake?,AWS_S3,file system," Seems like the data lake is more of a data warehouse in these cases, since they follow the traditional approach, with the only difference being that they use S3 instead of Oracle or Teradata or any other of those systems",S3,160,162
e391394d54efa84f0ba390553458c92e,pdt2va,boggle_thy_mind,https://www.reddit.com/r/dataengineering/comments/pdt2va/ingesting_google_ads/,Ingesting Google Ads,MELTANO,data ingestion,"**Google Ads** data (for the first time, never done it before), so far I've looked into Fivetran, Stitch, Singer, Meltano and Airbyte - all of them indicate as having google-ads as a source",Meltano,115,122
27991cbfd332da9036faa7dc7179916b,pdt2va,boggle_thy_mind,https://www.reddit.com/r/dataengineering/comments/pdt2va/ingesting_google_ads/,Ingesting Google Ads,MELTANO,data ingestion,Because Singer is having these issues I assume Meltano will as well,Meltano,48,55
e187c4bcd4af3bc78731f38618a54898,prdgxd,Relevant_take_2,https://www.reddit.com/r/dataengineering/comments/prdgxd/managing_a_data_warehouse_project_as_a_nonde_and/,"Managing a data warehouse project as a non-DE, and non-PM",APACHE_NIFI,workflow management,"But if it does go well, there's significant room for career (and CV",nifi,36,40
5466a06213d6c3488bc9d6f542801bf9,pnol2m,brownstrom,https://www.reddit.com/r/dataengineering/comments/pnol2m/data_profiling_for_a_large_dataset/,Data Profiling for a large dataset,APACHE_NIFI,workflow management,  How do I do data profiling on something so large to come up with a significant analysis of the data which is useful?,nifi,73,77
fbfbf4715e4a990d51425d3cf6f6f0df,pn2tc5,MaxGanzII,https://www.reddit.com/r/dataengineering/comments/pn2tc5/amazon_redshift_research_project_minimum_and/,"Amazon Redshift Research Project : Minimum and Maximum Values by Data Type (white paper, PDF)",APACHE_NIFI,workflow management,"During investigation, it also became clear that the mechanisms used to connect to Redshift - `psycopg2`, `psql`, `ODBC`, etc - all seems to be performing significant data processing, and at times are getting it wrong, leading to behaviour such as the silent modification of inserted values and incorrect values being presented from `SELECT`",nifi,158,162
826ac19c36aa953f8dc94baebb8b6205,pkxfd4,secodaHQ,https://www.reddit.com/r/dataengineering/comments/pkxfd4/rethinking_the_data_catalog/,Rethinking the data catalog,APACHE_NIFI,workflow management,"The tool should focus on the business users because they are the source of many discovery questions and have few options to find the answer for themselves.   Since coming to this understanding, we’ve made some significant changes to our product",nifi,214,218
94f683c4569472ec7ba465f751a05f8d,pkxfd4,secodaHQ,https://www.reddit.com/r/dataengineering/comments/pkxfd4/rethinking_the_data_catalog/,Rethinking the data catalog,APACHE_NIFI,workflow management,The first significant change is that we don't think of Secoda as a data catalog,nifi,14,18
22f87e9e6ce962616829da568f2fd58b,pdka0i,HighlyIllogicall,https://www.reddit.com/r/dataengineering/comments/pdka0i/creating_analytical_layer_using_spark_on_top_of/,Creating analytical layer using Spark on top of Parquet files,APACHE_NIFI,workflow management," so, the source system is a SQL server system:   \- I am thinking of pulling all the data in a parquet format using Nifi    \- Using spark I am gonna create tables/views out of the parquet files  \- connect Power BI and other visualization tools to Spark views/tables  However my concern is:  \- How to update parquet files whenever there are changes in the source",Nifi,117,121
cf06303daa264a9f8c0a7ac1b6ae9bc8,pdanrj,Born-Comment3359,https://www.reddit.com/r/dataengineering/comments/pdanrj/are_andy_pavlos_lectures_good_to_prepare_for_a/,Are Andy Pavlo's lectures good to prepare for a FAANG data engineer interview?,APACHE_NIFI,workflow management,"I couldn't find any good unified resources to prepare for a FAANG DE interview, and a lot of people adviced me Andy Pavlo's lectures on Youtube",nifi,27,31
87a8eeba16956920d90a84336404a671,ptdg0g,diegoelmestre,https://www.reddit.com/r/dataengineering/comments/ptdg0g/improvements_to_my_first_de_project_streaming/,Improvements to my first DE (?) project (Streaming Datawarehouse). What's next?,APACHE_SPARK,analytics,"Be free to suggest new techs (Sparks, Airflows, or even other GCP components (dataflow p.e.), I'm willing to learn it  &amp;#x200B;  &amp;#x200B;  https://preview.redd.it/lyap4qggf3p71.png?width=735&amp;format=png&amp;auto=webp&amp;s=fedf64446f22a27f195f172e653c7160a3295da6  Feel free to ask for more information",Spark,31,36
c753a3bd2ef6269aec8253ebb31fb968,ptcnp5,ZookeepergamePure467,https://www.reddit.com/r/dataengineering/comments/ptcnp5/need_help_to_advance_in_career/,Need help to advance in career,APACHE_SPARK,analytics,"I have mostly worked on SQL and spark and have a pretty good knowledge of Azure technologies like Databricks, data factory, data lake storage, etc",spark,33,38
fb1f0adae9d5413630ade1dd73c01d55,pt4t5v,Delicious_Attempt_99,https://www.reddit.com/r/dataengineering/comments/pt4t5v/scala_or_python_for_data_engineer/,Scala or Python for Data engineer?,APACHE_SPARK,analytics,"Hi All,  I’m a scala developer, not to a pro level, but I know scala with spark very well",spark,75,80
f1020de8d924f7e3e002565e5cd2deb9,psv1wj,Vorskl,https://www.reddit.com/r/dataengineering/comments/psv1wj/any_opinions_on_akretzs_learndataengineeringcom/,Any opinions on A.Kretz's learndataengineering.com ?,APACHE_SPARK,analytics,"  The courses look interesting, but I have some reservations that for example, Spark is covered in only 3 hrs ([https://learndataengineering.com/p/learning-apache-spark-fundamentals](https://learndataengineering.com/p/learning-apache-spark-fundamentals))",Spark,80,85
e9078956bddc952eb4f11cd3219741ee,pskxx5,mdl003,https://www.reddit.com/r/dataengineering/comments/pskxx5/best_tools_for_metadata_capture_indexing_for/,Best tools for metadata capture + indexing for delta/parquet tables?,APACHE_SPARK,analytics,Details of our team's current ETL process and our homegrown metadata capture/indexing solution below if that helps spark discussion,spark,116,121
fbbff5eeecea63afab562c4411324b96,pscnk0,raghukveer,https://www.reddit.com/r/dataengineering/comments/pscnk0/university_of_helsinki_is_providing_big_data/,University of Helsinki is providing Big Data Platforms Mooc (https://big-data-platforms-21.mooc.fi/),APACHE_SPARK,analytics,"Main topics are:  * distributed computing, * Warehouse-Scale Computers, * fault tolerance in distributed systems, * distributed file systems, * distributed batch processing with the MapReduce and the Apache Spark (PySpark",Apache Spark,201,213
bd15edd4d0681bc5e40a26e1baa2ea89,pryp6w,KimStacks,https://www.reddit.com/r/dataengineering/comments/pryp6w/less_than_1tb_of_data_what_tools_should_i_get/,Less than 1TB of data what tools should I get better at?,APACHE_SPARK,analytics,"I read https://docs.dask.org/en/latest/spark.html and in the very last line it said and I quote  &gt; you are looking to manage a terabyte or less of tabular CSV or JSON data, then you should forget both Spark and Dask and use Postgres or MongoDB",spark,40,45
81df88d751f02d47c5b36ccdf8d12140,pr96sa,vinsanity1603,https://www.reddit.com/r/dataengineering/comments/pr96sa/pyspark_etl_aws_glue_joining_on_nearest_timestamp/,Pyspark ETL (AWS Glue) Joining on Nearest Timestamp,APACHE_SPARK,analytics,How can I join the every-5-min data to the nearest timestamp in the every-1-min data using Pyspark,spark,94,99
a2c847ec53a7440d069568bc9c1155a6,pr6xg5,onelostsoul115,https://www.reddit.com/r/dataengineering/comments/pr6xg5/python_code_test_interview_general_career_advice/,Python Code Test (Interview) + general career advice,APACHE_SPARK,analytics,"Their tech stack is as follows:  SQL, Python, Clojure, Scala, AWS:Glue, Athena, Redshift, Apache Airflow, Kafka, Spark, Terraform  I'm a bit worried about the Python code test as my day to day and expertise is still mainly in pl/sql and pl/pgsql, so I need to brush up on my Python",Spark,114,119
bf472f124a313bbdfd8c31bbd9f5bbb1,pr6xg5,onelostsoul115,https://www.reddit.com/r/dataengineering/comments/pr6xg5/python_code_test_interview_general_career_advice/,Python Code Test (Interview) + general career advice,APACHE_SPARK,analytics,"file ingestion from S3 via Glue with some very basic spark transformations, very basic lamdbas etc",spark,54,59
59f1b13b465156d6955b8ada4e6551ce,pqty5b,scraper01,https://www.reddit.com/r/dataengineering/comments/pqty5b/stream_processing_tool_to_pair_with_kafka/,Stream processing tool to pair with Kafka,APACHE_SPARK,analytics,"So far i've learnt Spark for big data ETL, a bit of Big Query for ELT, Apache Airflow for small data ETL,  and at last Kafka as a message passing queue",Spark,20,25
b4fc3dfab19ccf775dc235df10ee3051,pqty5b,scraper01,https://www.reddit.com/r/dataengineering/comments/pqty5b/stream_processing_tool_to_pair_with_kafka/,Stream processing tool to pair with Kafka,APACHE_SPARK,analytics,"Between spark streaming, apache flink and apache storm, what do you think sinergizes the best with Kafka",spark,9,14
9aa431a4bdb8023c41c543d20cc20951,pq4dma,britishbanana,https://www.reddit.com/r/dataengineering/comments/pq4dma/how_do_you_handle_data_versioning_for/,How do you handle data versioning for reproducibility?,APACHE_SPARK,analytics," We are heavily based on Spark and we only recalculate our datasets a few times a year as new data comes in (lambda architecture), so this versioning strategy has been fine if suboptimal",Spark,26,31
77433b6e732eaba38da33de2c13d4985,pq4dma,britishbanana,https://www.reddit.com/r/dataengineering/comments/pq4dma/how_do_you_handle_data_versioning_for/,How do you handle data versioning for reproducibility?,APACHE_SPARK,analytics," I've seen some tools such as Pachyderm that attempt to address this, but have no idea how well they work in practice - and haven't seen anything built more for a Spark context",Spark,164,169
ad3776a65766e3ed3e562aba440f7280,ppuh5c,hatchikyu,https://www.reddit.com/r/dataengineering/comments/ppuh5c/if_i_had_to_explain_data_engineering_work_to_a/,If I had to explain data engineering work to a business colleague...,APACHE_SPARK,analytics," **Supports the following kind of work (that business people understand):**  * Machine learning * Data Science * Deep Learning  **Most common jargon**  ETL  - extract-transform-load — tooling to move data from place to place  **Scope of work**  * Enormous amounts of data means heavy lifting around **scalability** * Responsible for deciding what data is useful and what is superfluous * Today’s data engineers are essentially specialist software engineers  **Capability areas**  * SDLC best practice - version, control, release management, automated pipelines, implementing open-source tools like Spark and Tensorflow * InfoSec - cloud security best practice, data handling, data privacy, GDPR, OSS security etc",Spark,599,604
2dfd2c0fa1999eaf51876cd53a62f526,ppmc48,getafterit123,https://www.reddit.com/r/dataengineering/comments/ppmc48/spark_and_s3_integration/,Spark and S3 integration,APACHE_SPARK,analytics,Has anyone been able to connect spark 3.0+ to S3 object store using s3 connector or only s3a,spark,33,38
814a9dff5f49ec057b148a1565f13915,poimtb,brownstrom,https://www.reddit.com/r/dataengineering/comments/poimtb/data_profiling_reviews_on_dbtprofiler_or_any/,Data Profiling: Reviews on dbt-profiler or any similar tool?,APACHE_SPARK,analytics,  Don't like pandas profiler as it doesn't use Spark so it would be very expensive to convert spark df to pandas for data profiling,Spark,48,53
d58041c1498e8aab2fabba3409794f0d,poi4im,gloriarachel77,https://www.reddit.com/r/dataengineering/comments/poi4im/how_can_i_become_a_data_engineer/,How can I become a data engineer?,APACHE_SPARK,analytics,"I took several courses regarding Hadoop and PySpark, but still feel a little confused",Spark,47,52
00f8064f44fb54e9352cae7840de4378,po9ru6,theant97,https://www.reddit.com/r/dataengineering/comments/po9ru6/mind_fish_confused/,Mind fish : confused,APACHE_SPARK,analytics,"Complete python, sql and spark courses and become a de  2",spark,26,31
baf2388097fbe6ccb0f9dbe1e14e8d95,po8sm8,monistordualist,https://www.reddit.com/r/dataengineering/comments/po8sm8/pyspark_on_kubernetes_a_production_boilerplate/,PySpark on Kubernetes: A Production Boilerplate Framework,APACHE_SPARK,analytics,"I spent some time looking for an all-in-one template/demo for how to run PySpark jobs on Kubernetes--and couldn't quite find something fully fledged, so I made one myself specifically with data scientists and engineers in mind",Spark,76,81
8bd85f9c6d09e6fb2ff7829381921831,po8sm8,monistordualist,https://www.reddit.com/r/dataengineering/comments/po8sm8/pyspark_on_kubernetes_a_production_boilerplate/,PySpark on Kubernetes: A Production Boilerplate Framework,APACHE_SPARK,analytics, Here's the repo: [https://github.com/Albell-Cloud-Labs/pyspark-k8s-boilerplate](https://github.com/Albell-Cloud-Labs/pyspark-k8s-boilerplate,spark,59,64
9b4a2ca67e8f8c2ef433186c0bf2641b,po1np1,FeelsToWaltz,https://www.reddit.com/r/dataengineering/comments/po1np1/starting_my_first_de_role_good_resources_for/,Starting my first DE role - good resources for learning Scala and Spark?,APACHE_SPARK,analytics,I'm transitioning into a role as a Data Engineer at a company that primarily uses Scala as well as Spark and Hadoop,Spark,100,105
108b2282d036d196a3ab6928008c12a3,pny53c,sgtbrecht,https://www.reddit.com/r/dataengineering/comments/pny53c/an_alternative_to_aws_solutions_architect_course/,An alternative to AWS Solutions Architect course on Udemy?,APACHE_SPARK,analytics,"I then watched a bunch of videos on youtube and udemy on Python, Pandas API and Spark",Spark,81,86
ac80d2f8a8cd489a8c401441533c27b6,pnmvkm,treacherous_tim,https://www.reddit.com/r/dataengineering/comments/pnmvkm/upskilling_in_api_service_development_as_a_data/,Upskilling in API / Service development as a data engineer,APACHE_SPARK,analytics,"I've worked for a while as a data engineer building out pipelines using Airflow, Spark, etc",Spark,82,87
84fcb4ca41ec5823ce88fa2bfc9222b0,pmeio7,O_its_that_guy_again,https://www.reddit.com/r/dataengineering/comments/pmeio7/im_looking_for_advice_on_a_beginner_data/,I'm looking for advice on a beginner data engineering project.,APACHE_SPARK,analytics," &amp;#x200B;  We are going through SQL and Spark over the course, so I'll be using those to the extent that I can, along with python",Spark,45,50
a5be56d26aed6356527f5870cd1cabf5,pmeg4k,O_its_that_guy_again,https://www.reddit.com/r/dataengineering/comments/pmeg4k/advice/,Advice,APACHE_SPARK,analytics," &amp;#x200B;  We are going through SQL and Spark over the course, so I'll be using those to the extent that I can, along with python",Spark,45,50
9e3ae665f98bdcf1668a2ae1ddcdcd9b,pljfsl,ckdatanerd,https://www.reddit.com/r/dataengineering/comments/pljfsl/best_ways_to_learn_advanced_databricks_pyspark/,Best Ways To Learn Advanced Databricks (Pyspark),APACHE_SPARK,analytics,"I have a lot of opportunity to work on what I want to, and some of the cooler projects I have gotten involved with use Databricks (pyspark — ETL pipelines, optimizing ML notebooks for production, optimizing cluster usage",spark,134,139
d3e1e6dfe9179146135317b9fbdbb191,pljfsl,ckdatanerd,https://www.reddit.com/r/dataengineering/comments/pljfsl/best_ways_to_learn_advanced_databricks_pyspark/,Best Ways To Learn Advanced Databricks (Pyspark),APACHE_SPARK,analytics,"I have found various sources online on my own (reviewed documentation, read the book Learning Spark 2.0), but I have been having trouble finding a book that covers more advanced pyspark utilization and dives into how to optimize different parameters",Spark,95,100
126448015e7a8b7a8a4b9ad7dd3024a9,pljfsl,ckdatanerd,https://www.reddit.com/r/dataengineering/comments/pljfsl/best_ways_to_learn_advanced_databricks_pyspark/,Best Ways To Learn Advanced Databricks (Pyspark),APACHE_SPARK,analytics,"The book Learning Spark 2.0 has been immensely helpful for me so far, and I am in hope of finding an “advanced” version of it or other useful resources",Spark,19,24
fec62082dc18d9e609ae85d298816e56,pli0og,MediumZealousideal29,https://www.reddit.com/r/dataengineering/comments/pli0og/skills_required/,Skills required,APACHE_SPARK,analytics,I am very good at spark,spark,19,24
f2527b3a20b4e9e5f845e7772464b8f8,pli0og,MediumZealousideal29,https://www.reddit.com/r/dataengineering/comments/pli0og/skills_required/,Skills required,APACHE_SPARK,analytics,"I know SQL, hdfs, hive, control M..I also learned airflow, sqoop and basics of spark streaming, Kafka and AWS",spark,80,85
b1b13215a4d87565f5ceff73622724f1,pkd8uk,deveid,https://www.reddit.com/r/dataengineering/comments/pkd8uk/how_to_validate_a_table_refresh_in_hive/,How to validate a table refresh in hive,APACHE_SPARK,analytics,"Using pyspark, but not sure what cases I can check for",spark,9,14
f16aebd0e03607a37eaa63006417c5e9,pk78fp,ClumsyRooster,https://www.reddit.com/r/dataengineering/comments/pk78fp/airflow_spark_other_tool/,"Airflow, Spark, other tool ?",APACHE_SPARK,analytics,So I took the time to use Airflow + Spark,Spark,37,42
6a2ce30e804d76ded146aab9a0da4feb,pk78fp,ClumsyRooster,https://www.reddit.com/r/dataengineering/comments/pk78fp/airflow_spark_other_tool/,"Airflow, Spark, other tool ?",APACHE_SPARK,analytics, What's the advantage of using Spark instead of Airflow for small processing ,Spark,32,37
ec259b4fc419903ecee1106579d07ae0,pjt56n,gamecockguy2003,https://www.reddit.com/r/dataengineering/comments/pjt56n/best_way_to_get_snapshotfull_dataset_from_changes/,Best way to get snapshot/full dataset from changes,APACHE_SPARK,analytics, I've been trying to do this with Spark but am struggling with doing this performantly given the changes are spread throughout the dataset,Spark,35,40
b011b64a7c8837835b4ef63b75b5c42a,pjsuu8,Irmodude2003,https://www.reddit.com/r/dataengineering/comments/pjsuu8/best_way_to_get_snapshotfull_dataset_from_changes/,Best way to get snapshot/full dataset from changes,APACHE_SPARK,analytics, I've been trying to do this with Spark but am struggling with doing this performantly given the changes are spread throughout the dataset,Spark,35,40
33f4ed8040ec5b504b769382fca4b636,pjf1ui,Gawgba,https://www.reddit.com/r/dataengineering/comments/pjf1ui/taming_big_data_with_apache_spark_and_python/,Taming Big Data with Apache Spark and Python - Hands On! question,APACHE_SPARK,analytics,"the course uses Spark 2 when the most recent version is 3, and seems to have a very long section on RDDs but I thought I'd heard that RDDs were no longer in favor and dataframes are where it's at",Spark,17,22
02c52cb8a82a8b628412e41284d35522,pii29n,dolphinday2,https://www.reddit.com/r/dataengineering/comments/pii29n/programming_etl_vs_sql_etl/,Programming ETL vs SQL ETL,APACHE_SPARK,analytics,"Because for Scala for example, you would use Spark SQL, which is really just SQL at the end of the day",Spark,46,51
8a74eb98301eb20e8bf45c92ab6c3b8c,ph4fvj,WalrusWhich202,https://www.reddit.com/r/dataengineering/comments/ph4fvj/how_to_querying_data_faster/,How to Querying data faster,APACHE_SPARK,analytics," I've looked into spark, hadoop, cassandra, hdfs, and others",spark,19,24
3e308f0ca528af7224220d58ae302889,ph17wi,Efficient_Camel6175,https://www.reddit.com/r/dataengineering/comments/ph17wi/data_engineering_project/,Data Engineering Project,APACHE_SPARK,analytics,Can someone provide Simple Data Engineering Project using Hadoop and Spark for reference?,Spark,70,75
6d442c51c3d7745569c132eea199bc7b,ph15au,SukalpVashishtha,https://www.reddit.com/r/dataengineering/comments/ph15au/microservice_shared_database_antipattern_question/,Microservice shared database antipattern question,APACHE_SPARK,analytics,  Is it a fair design pattern that a stream processing framework (spark/kafka streams etc,spark,67,72
24c382cd02ab3744d2a503d7bd3e1dbf,pgs1z3,Kassme,https://www.reddit.com/r/dataengineering/comments/pgs1z3/spark_dfs_vs_pandas_dfs/,Spark DF’s vs Pandas DF’s,APACHE_SPARK,analytics,"Hello fellow DE’s, I’m curious for those of you that use notebooks to interface with spark (I’m working with PySpark notebooks in Azure Synapse",spark,86,91
c6c87007dbc8e1516a9785fb55cfb925,pgs1z3,Kassme,https://www.reddit.com/r/dataengineering/comments/pgs1z3/spark_dfs_vs_pandas_dfs/,Spark DF’s vs Pandas DF’s,APACHE_SPARK,analytics,- do you think it’s worth learning how to use native spark DF’s,spark,54,59
80e47af4a60224101f0708ed932f5bd3,pgs1z3,Kassme,https://www.reddit.com/r/dataengineering/comments/pgs1z3/spark_dfs_vs_pandas_dfs/,Spark DF’s vs Pandas DF’s,APACHE_SPARK,analytics,Currently I have been told to just use pandas because it’s what I’m familiar with but I wonder if it’s worth the effort to learn to use the DF methods that are native to spark,spark,171,176
d17048c1cfeec3709f23778d157ee17c,pgs1z3,Kassme,https://www.reddit.com/r/dataengineering/comments/pgs1z3/spark_dfs_vs_pandas_dfs/,Spark DF’s vs Pandas DF’s,APACHE_SPARK,analytics,"  PS pls refrain from recommending an option C in this case, I don’t get to choose the stack I have to work with in this project, it’s either pandas or PySpark df’s",Spark,155,160
ef45cc18015748936f30d29e983a30ce,pggz3t,pknpkn21,https://www.reddit.com/r/dataengineering/comments/pggz3t/cicd_for_de_pipeline/,CI/CD for DE Pipeline,APACHE_SPARK,analytics,"Hi,  We are currently in the process of setting up a data processing pipeline for few of our data sources and the processing logic is designed in Pyspark with Airflow for orchestration in AWS environment",spark,149,154
1e6b8253d491acf5937fc91b97f0c3e4,pfv18d,Godmons,https://www.reddit.com/r/dataengineering/comments/pfv18d/spark_jobs_should_we_define_schema_on_read/,Spark Jobs : Should we define schema on read ?,APACHE_SPARK,analytics,"Hi guys,     When importing a dataframe from parquet or other file format in spark, we can either infer or specify the schema (data types",spark,78,83
38374f3592840b0a5418a857cf1227ea,pfv18d,Godmons,https://www.reddit.com/r/dataengineering/comments/pfv18d/spark_jobs_should_we_define_schema_on_read/,Spark Jobs : Should we define schema on read ?,APACHE_SPARK,analytics," On my previous company, we were using spark dataframe &amp; INFERING before processing.On my current company, we are specifying the schema on each read",spark,40,45
1548b0bbff225d6661dfe10cbddc4925,pfemin,Zorkol02,https://www.reddit.com/r/dataengineering/comments/pfemin/cloud_certification_help/,Cloud Certification Help,APACHE_SPARK,analytics,"I know python, sql, bash, pyspark and airflow, but not an expert yet just in case",spark,29,34
60dc2c6406d7eb66ccea866b2a51ae94,peyiec,lurakona,https://www.reddit.com/r/dataengineering/comments/peyiec/thinking_about_pivoting_from_swe/,Thinking about Pivoting from SWE,APACHE_SPARK,analytics,I spoke with a Data Engineer and this is what originally sparked my interest,spark,58,63
b14acd91fd441bc90cfd8d85aa09dbeb,peap7h,CoMatrix1234,https://www.reddit.com/r/dataengineering/comments/peap7h/a_self_governing_data_gateway/,A self governing data gateway,APACHE_SPARK,analytics," Our ecosystem: AWS, Okta, S3, terraform, looking at Amundsen, Spark, cloud monitoring tools",Spark,64,69
8cb1d551d2af8b60a68bd73ef94ee936,pe3i1b,OkDetective1169,https://www.reddit.com/r/dataengineering/comments/pe3i1b/data_science_domain_job_title_and_description/,""Data Science"" Domain: Job Title and Description confusion,APACHE_SPARK,analytics, I really love the engineering aspect of helping the data scientists get what they need through pipelines using AWS/SQL/PySpark/Python and sometimes Tableau,Spark,123,128
