KEYWORD_SENTENCE_ID,POST_ID,AUTHOR,URL,TITLE,KEYWORD,KEYWORD_CATEGORY,SENTENCE_TEXT,MATCH_SUBSTRING,START_POSITION,END_POSITION
b62b5773ab0479fddf94e9c598336fb4,pktcp3,noNSFWcontent,https://www.reddit.com/r/dataengineering/comments/pktcp3/can_someone_help_me_understand_the_difference/,Can someone help me understand the difference between the the docker-compose files?,DOCKER,containerization,"   **The first docker compose file is  -**           version: '3.9'               #asking for a postgres database     services:       postgres:         image: postgres:9.6         environment:           - POSTGRES_USER=airflow           - POSTGRES_PASSWORD=airflow           - POSTGRES_DB=airflow         logging:           options:             max-size: 10m             max-file: 3               #asking for a webserver       webserver:         build: ./dockerfiles         restart: always         depends_on:           - postgres         environment:           - LOAD_EX=n           - EXECUTOR=Local         logging:           options:             max-size: 10m             max-file: 3         volumes:           - ./dags:/usr/local/airflow/dags           # - ./plugins:/usr/local/airflow/plugins         ports:           - 8080:8080         command: webserver         healthcheck:           test: [CMD-SHELL, [ -f /usr/local/airflow/airflow-webserver.pid ]]           interval: 30s           timeout: 30s           retries: 3   For the above docker compose file, the dockerfiles folder had Dockerfile with the following text -       FROM puckel/docker-airflow          RUN pip install requests     RUN pip install pandas  **The second docker compose file is -**         version: '3'     services:       postgres:         image: postgres:9.6         environment:           - POSTGRES_USER=airflow           - POSTGRES_PASSWORD=airflow           - POSTGRES_DB=airflow         ports:           - 5432:5432            webserver:         image: puckel/docker-airflow:1.10.1         build:           context: https://github.com/puckel/docker-airflow.git#1.10.1           dockerfile: Dockerfile           args:             AIRFLOW_DEPS: gcp_api,s3             PYTHON_DEPS: sqlalchemy==1.2.0         restart: always         depends_on:           - postgres         environment:           - LOAD_EX=n           - EXECUTOR=Local           - FERNET_KEY=jsDPRErfv8Z_eVTnGfF8ywd19j4pyqE3NpdUBA_oRTo=         volumes:           - ./examples/intro-example/dags:/usr/local/airflow/dags           # Uncomment to include custom plugins           # - ./plugins:/usr/local/airflow/plugins         ports:           - 8080:8080         command: webserver         healthcheck:           test: [CMD-SHELL, [ -f /usr/local/airflow/airflow-webserver.pid ]]           interval: 30s           timeout: 30s           retries: 3       When the second docker compose was stuck in a dependency hell, I noticed both were pulling the same Airflow puckel image",docker,16,22
6c8d85fb0ef4762351aae4397c39c828,pktcp3,noNSFWcontent,https://www.reddit.com/r/dataengineering/comments/pktcp3/can_someone_help_me_understand_the_difference/,Can someone help me understand the difference between the the docker-compose files?,DOCKER,containerization,"  So, I tweaked the second docker compose to looked like the first one and it first right up",docker,28,34
9ca9a7005598c2994c7ef796d0b3acb2,pj99xo,noNSFWcontent,https://www.reddit.com/r/dataengineering/comments/pj99xo/please_help_me_understand_how_to_go_about_working/,Please help me understand how to go about working on a personal project.,DOCKER,containerization,             then display the prices on the front end    I am also in the process of looking for data science jobs so want to use tools like docker and a noSQL database like Mongodb to add to my resume,docker,142,148
72e1b928c4e111c54de6b51c0cfbde6c,pj99xo,noNSFWcontent,https://www.reddit.com/r/dataengineering/comments/pj99xo/please_help_me_understand_how_to_go_about_working/,Please help me understand how to go about working on a personal project.,DOCKER,containerization,  I know there are different backend server containers like FastAPI available in docker as well as noSQL databases like Mongodb,docker,82,88
565bab7715276abc707d251438d306f7,piu290,raghukveer,https://www.reddit.com/r/dataengineering/comments/piu290/is_it_mandatory_to_work_as_a_dbadata_analyst_to/,Is it mandatory to work as a DBA/Data Analyst to become a DE?,DOCKER,containerization," In past, I worked as an IT consultant for 2 small companies with Docker, Kubernetes, Linux, but have no experience with data-related works",Docker,67,73
586e20b1ba6a88e077adc98a62f6fa88,pcrlzi,Professional_Crazy49,https://www.reddit.com/r/dataengineering/comments/pcrlzi/confused_about_de_vs_sde/,Confused about DE vs SDE,DOCKER,containerization," The Confusion:  So one of my friends works as a software engineer 1 and he has worked with kafka, docker, aws, prometheus, spark",docker,100,106
fdca76c925bfb3e61f23401b80c5a904,pceu26,skpfm_06,https://www.reddit.com/r/dataengineering/comments/pceu26/been_working_in_a_small_startup_for_almost_2/,"Been working in a small startup for almost 2 years doing pretty much everything on the engineering side, what should I focus on and pursue moving forward?",DOCKER,containerization,Dockerise stuff when needed 9,Docker,1,7
10da833d9c7fdd4456576ba23744b63f,pli6w5,Material-Bridge,https://www.reddit.com/r/dataengineering/comments/pli6w5/creating_an_end_to_end_object_detection_pipeline/,Creating an end to end Object detection Pipeline,APACHE_CASSANDRA,datastores,  I was thinking about using a NOSQL db (Cassandra,Cassandra,42,51
f8f138fa31b8af022cf0d78c67ee8b6a,ph4fvj,WalrusWhich202,https://www.reddit.com/r/dataengineering/comments/ph4fvj/how_to_querying_data_faster/,How to Querying data faster,APACHE_CASSANDRA,datastores," I've looked into spark, hadoop, cassandra, hdfs, and others",cassandra,34,43
02660757dcf8c28faeea0b4944e72e71,pe9f42,TiDuNguyen,https://www.reddit.com/r/dataengineering/comments/pe9f42/purely_columnar_database_suggestion/,Purely columnar database suggestion,APACHE_CASSANDRA,datastores,or not *purely* columnar (e.g.: Cassandra actually store data in partitions of rows and columns rather than actual columns).,Cassandra,33,42
608c99783d495dce993cd3caca1b6789,pt90kg,ArunMu,https://www.reddit.com/r/dataengineering/comments/pt90kg/clickhouse_and_apache_pinot/,ClickHouse and Apache Pinot,CLICKHOUSE,datastores,I had posted my findings about both ClickHouse and Apache Pinot at [https://www.reddit.com/r/bigdata/comments/pse4gb/clickhouse\_and\_apache\_pinot/](https://www.reddit.com/r/bigdata/comments/pse4gb/clickhouse_and_apache_pinot/,ClickHouse,37,47
9efcc79631b9cacf0416b91236a026e6,pqeipn,QuaternionHam,https://www.reddit.com/r/dataengineering/comments/pqeipn/standardbest_ways_of_moving_data_between_databases/,Standard/Best ways of moving data between Databases,CLICKHOUSE,datastores,"(for example, Postgre to Clickhouse",Clickhouse,26,36
f3c316faf982279b45d566d4d56000e7,pqeipn,QuaternionHam,https://www.reddit.com/r/dataengineering/comments/pqeipn/standardbest_ways_of_moving_data_between_databases/,Standard/Best ways of moving data between Databases,CLICKHOUSE,datastores," &amp;#x200B;  We are currently just dumping data from Postgre to a CSV then copying that file using scp to the host where our Clickhouse instance is running (everything on-premises), and finally inserting from that file into our DW",Clickhouse,128,138
3205aa4629cb3ae3dd6e38ef7ed9ec05,pqeipn,QuaternionHam,https://www.reddit.com/r/dataengineering/comments/pqeipn/standardbest_ways_of_moving_data_between_databases/,Standard/Best ways of moving data between Databases,CLICKHOUSE,datastores,and then loading them into our DW using ClickHouse Hook,ClickHouse,41,51
cf0fdc94410b7dd0ded44032aececd54,pt88mq,vektor888,https://www.reddit.com/r/dataengineering/comments/pt88mq/any_des_working_in_a_company_implementing_the/,Any DEs working in a company implementing the Spotify model?,APACHE_ATLAS,data governance and registries,"Hi,   as the title might suggest, I've been working in a company implementing some flavour of the [Spotify model](https://www.atlassian.com/agile/agile-at-scale/spotify",atlas,127,132
f937b720497c1bff7947a9494158b298,pq9f8b,noNSFWcontent,https://www.reddit.com/r/dataengineering/comments/pq9f8b/i_just_had_an_interview_with_a_senior_data/,"I just had an interview with a Senior Data Engineer and the head of the Data Science department of a company and they said, in the next interview they'd see how I think.",KINESIS,data ingestion,"We had a good conversation about my work experience which was not quite of a data engineer and my personal experience working with AWS tools such as EC2, Kinesis, Lambda, DynamoDB and S3",Kinesis,155,162
96d43795b403a7cfa38bf2bda072a542,pl9n2x,DatKalvin,https://www.reddit.com/r/dataengineering/comments/pl9n2x/is_this_architecture_cost_effective_performant/,Is this Architecture cost effective &amp; performant? What's your suggestion.,KINESIS,data ingestion,We are also thinking of Kinesis Firehose replacing DMS but haven't figured out the possibility of this,Kinesis,25,32
c89af29128ba5f50ab1eaca5b7b05d4d,pli0og,MediumZealousideal29,https://www.reddit.com/r/dataengineering/comments/pli0og/skills_required/,Skills required,APACHE_SQOOP,data ingestion,"I know SQL, hdfs, hive, control M..I also learned airflow, sqoop and basics of spark streaming, Kafka and AWS",sqoop,60,65
8cc686ceaab6c0f1b0cb69dca0bde284,peieca,Ok-Sentence-8542,https://www.reddit.com/r/dataengineering/comments/peieca/how_do_you_guys_validate_your_data_how_does_your/,"How do you guys validate your data? How does your process look like and which tools are you using? Our main Stack: Databricks, Azure Datafactory, Data Lake",GREAT_EXPECTATIONS,testing,"Could we use databricks + Great Expectations + some Error Handling Logic (Logic App, etc",Great Expectations,27,45
b0173ed612c3bfceba3014705931f905,ptazl0,The_small_print,https://www.reddit.com/r/dataengineering/comments/ptazl0/corise_learning_platform_dbt_analytics/,Co:Rise Learning Platform &amp; dbt Analytics Engineering Course,DBT,data transformation, They recently announced an Analytics Engineering course that looks to use dbt for various projects over a few weeks,dbt,76,79
ec9ce319fe226418d1429a40e7290273,ptazl0,The_small_print,https://www.reddit.com/r/dataengineering/comments/ptazl0/corise_learning_platform_dbt_analytics/,Co:Rise Learning Platform &amp; dbt Analytics Engineering Course,DBT,data transformation, [Here's a link to the course in quesiton](https://corise.com/course/analytics-engineering-with-dbt?utm_source=emilyh),dbt,97,100
53dba0975047f7e47193cd55a33b9b93,pssfyi,sb2nov,https://www.reddit.com/r/dataengineering/comments/pssfyi/analytics_engineering_with_dbt_course_looking_for/,Analytics engineering with dbt Course - Looking for feedback,DBT,data transformation,"Emily Hawkins, Data Engineering Lead at Drizly/Uber and I are leading a live, cohort based course on dbt starting November 15th",dbt,102,105
d8bcd44b144f3908827c7aabbe9c7564,pssfyi,sb2nov,https://www.reddit.com/r/dataengineering/comments/pssfyi/analytics_engineering_with_dbt_course_looking_for/,Analytics engineering with dbt Course - Looking for feedback,DBT,data transformation,[https://corise.com/course/analytics-engineering-with-dbt](https://corise.com/course/analytics-engineering-with-dbt,dbt,55,58
baf94bb0fbc35877f7c1dd13c50bea38,pskxx5,mdl003,https://www.reddit.com/r/dataengineering/comments/pskxx5/best_tools_for_metadata_capture_indexing_for/,Best tools for metadata capture + indexing for delta/parquet tables?,DBT,data transformation,and dbt but doesn't look like either fits our use case very well on first read,dbt,5,8
57a68232d9d569a6ee92c4c6ed66b1be,ps702d,third_dude,https://www.reddit.com/r/dataengineering/comments/ps702d/should_you_flatten_json_from_apis_as_you_are/,Should you flatten json from apis as you are loading it into staging tables or afterwards with dbt?,DBT,data transformation,  If we are loading api results into snowflake for instance or bigquery is it better to just dump the thing in that nested structure and dbt everything out of it later,dbt,138,141
6f3feab860fa2fb772bf91e4d5d66b55,poqthi,Material_Cheetah934,https://www.reddit.com/r/dataengineering/comments/poqthi/documenting_by_parsing_sql_into_diagrams/,Documenting by parsing SQL into diagrams?,DBT,data transformation,"I have heard of DBT, but I have constraints that will prevent me from using it, either that or my understanding is limited",DBT,17,20
082e601709dc51e1f1ea04edc3604517,pomqcg,dadadawe,https://www.reddit.com/r/dataengineering/comments/pomqcg/dbt_looker_whats_it_all_about/,"DBT, Looker, ... what's it all about?",DBT,data transformation,but now I see more and more references to DBT &amp; Looker,DBT,43,46
d23a02194c5c93afa354fb01bed67b59,poimtb,brownstrom,https://www.reddit.com/r/dataengineering/comments/poimtb/data_profiling_reviews_on_dbtprofiler_or_any/,Data Profiling: Reviews on dbt-profiler or any similar tool?,DBT,data transformation,I came across **dbt**\-**profile** and also **pandas profiler**,dbt,17,20
41db9d07ebf15c054b161f44eed2dd99,poimtb,brownstrom,https://www.reddit.com/r/dataengineering/comments/poimtb/data_profiling_reviews_on_dbtprofiler_or_any/,Data Profiling: Reviews on dbt-profiler or any similar tool?,DBT,data transformation,  dbt-profiler is still in beta and kind off new to the market,dbt,3,6
0138279b85e4bfcde1f7a97312e8371f,po6zh0,Nervous-Chain-5301,https://www.reddit.com/r/dataengineering/comments/po6zh0/aws_managed_airflow_or_aws_sam_for_simple_etls/,AWS Managed Airflow or AWS SAM for Simple ETLs,DBT,data transformation,My company's core data stack is Fivetran + Snowflake + DBT + Looker,DBT,56,59
53f54e92c3bb94b606b19d22f0e7ea5d,po6zh0,Nervous-Chain-5301,https://www.reddit.com/r/dataengineering/comments/po6zh0/aws_managed_airflow_or_aws_sam_for_simple_etls/,AWS Managed Airflow or AWS SAM for Simple ETLs,DBT,data transformation,"Fivetran is our data loading tool, we load raw data into Snowflake, and process using DBT",DBT,87,90
d4cef9c41838912821817c64b320871a,pnixoi,CreativeAd6756,https://www.reddit.com/r/dataengineering/comments/pnixoi/soda_sql_vs_dbt_tests/,Soda SQL vs DBT tests,DBT,data transformation,We are already using dbt in our project so should we go with DBT tests,dbt,22,25
5212b99013a4d8f3098f67d59d8ca531,pnixoi,CreativeAd6756,https://www.reddit.com/r/dataengineering/comments/pnixoi/soda_sql_vs_dbt_tests/,Soda SQL vs DBT tests,DBT,data transformation, Or Soda sql have more advantages over DBT tests,DBT,40,43
4eb970d3f9bca5c834d3eca4d9d32542,pl3pos,TheLoveBoat,https://www.reddit.com/r/dataengineering/comments/pl3pos/im_a_data_engineer_how_do_i_become_a_better/,I'm a Data Engineer. How do I become a better Software Engineer?,DBT,data transformation,"I work with the modern data stack, so I'm comfortable building data pipelines using tools like Airflow and dbt",dbt,108,111
3423171da64d152c0ad89ce7fa76f383,pgv4vw,el_jeep0,https://www.reddit.com/r/dataengineering/comments/pgv4vw/considering_taking_analytics_engineering_role_for/,"Considering taking Analytics Engineering role for a while, can I go back to Data Engineering after, will it be harder?",DBT,data transformation,"customer-facing, it will deepen my SQL/DBT skills and allow me to maybe pick up some looker",DBT,40,43
55db54d869da9b8f7099f05aa77536d7,pfigsg,QuaternionHam,https://www.reddit.com/r/dataengineering/comments/pfigsg/freelance_de/,Freelance DE,DBT,data transformation,I have the opportunity to make some freelance DE jobs (dbt and cloud technologies mostly,dbt,56,59
36e97a460278ab8d8b8a33eb0dbaec8c,pcokrh,dathu9,https://www.reddit.com/r/dataengineering/comments/pcokrh/is_dbt_can_be_used_at_the_enterprise_level/,is dbt can be used at the enterprise level?,DBT,data transformation,I just start evaluating the dbt (data build tool,dbt,29,32
fe5d8c8c8645d1bec6416c840fc9a4ef,pcokrh,dathu9,https://www.reddit.com/r/dataengineering/comments/pcokrh/is_dbt_can_be_used_at_the_enterprise_level/,is dbt can be used at the enterprise level?,DBT,data transformation,product for our analytics team to perform analytical transformations with dbt,dbt,75,78
498589d09dc7d19a535477709cb542d9,pcokrh,dathu9,https://www.reddit.com/r/dataengineering/comments/pcokrh/is_dbt_can_be_used_at_the_enterprise_level/,is dbt can be used at the enterprise level?,DBT,data transformation,Can some please comment is below items achievable with dbt,dbt,56,59
f1989974cf757abc86105b787c5f53e3,pcokrh,dathu9,https://www.reddit.com/r/dataengineering/comments/pcokrh/is_dbt_can_be_used_at_the_enterprise_level/,is dbt can be used at the enterprise level?,DBT,data transformation,Can dbt support multi db connections in one model query,dbt,5,8
8f461bb5fc722a30efce7da13107f29e,pcokrh,dathu9,https://www.reddit.com/r/dataengineering/comments/pcokrh/is_dbt_can_be_used_at_the_enterprise_level/,is dbt can be used at the enterprise level?,DBT,data transformation,Can dbt read one snowflake and save the results into postgre,dbt,5,8
d89e46030c141e62b2ceba6cfb159e4c,pcokrh,dathu9,https://www.reddit.com/r/dataengineering/comments/pcokrh/is_dbt_can_be_used_at_the_enterprise_level/,is dbt can be used at the enterprise level?,DBT,data transformation,Can dbt read the data from s3 without EMR cluster (Spark cluster,dbt,5,8
bf739d67b7de6f1d62351cd74dd8847b,pcokrh,dathu9,https://www.reddit.com/r/dataengineering/comments/pcokrh/is_dbt_can_be_used_at_the_enterprise_level/,is dbt can be used at the enterprise level?,DBT,data transformation,Can dbt store the output to s3 or onedrive storage?,dbt,5,8
3d6a1cf7fe73413cfb8a59e6ff1d5730,pondby,nezamolmolk,https://www.reddit.com/r/dataengineering/comments/pondby/hierarchical_treemap_from_scratch_with_no/,Hierarchical Treemap from scratch with no aggregation,APACHE_DRILL,data virtualization, The idea is therefore to create a Treemap visualization with drill down / up functionality to get an idea of ​​the value of each level / each sub level,drill,63,68
0ea59d76c9265dc711f42d2dcc4ecaaf,ptdg0g,diegoelmestre,https://www.reddit.com/r/dataengineering/comments/ptdg0g/improvements_to_my_first_de_project_streaming/,Improvements to my first DE (?) project (Streaming Datawarehouse). What's next?,APACHE_KAFKA,data ingestion," We adopted the Apache Kafka ecosystem and Bigquery for DWH, MongoDB is our operational database",Apache Kafka,17,29
458eb55a53353688c048d3e7f36c8997,ptdg0g,diegoelmestre,https://www.reddit.com/r/dataengineering/comments/ptdg0g/improvements_to_my_first_de_project_streaming/,Improvements to my first DE (?) project (Streaming Datawarehouse). What's next?,APACHE_KAFKA,data ingestion,    1 - We have a Kafka Connect running that grabs the changes from our MongoDB collections,Kafka,19,24
3bfd6c879175e8b802decd5cc157cf77,ptdg0g,diegoelmestre,https://www.reddit.com/r/dataengineering/comments/ptdg0g/improvements_to_my_first_de_project_streaming/,Improvements to my first DE (?) project (Streaming Datawarehouse). What's next?,APACHE_KAFKA,data ingestion, 2 - The connector stores the data in a Kafka topic  3 - We are also running ksqlDB to make most of the transformations and a few aggregations,Kafka,41,46
6ed967d881d32e9f20f89016ec76c053,ptdg0g,diegoelmestre,https://www.reddit.com/r/dataengineering/comments/ptdg0g/improvements_to_my_first_de_project_streaming/,Improvements to my first DE (?) project (Streaming Datawarehouse). What's next?,APACHE_KAFKA,data ingestion,  4 - Transformed data is sent to the new Kafka Topic  \-- My biggest uncertainty about all systems starts here,Kafka,43,48
8eda24ffb994faecd73238cfdcb6f4d7,pskxx5,mdl003,https://www.reddit.com/r/dataengineering/comments/pskxx5/best_tools_for_metadata_capture_indexing_for/,Best tools for metadata capture + indexing for delta/parquet tables?,APACHE_KAFKA,data ingestion,Raw data is passed by the application to various Kafka topics where it's streamed into s3 buckets,Kafka,50,55
af451e7e3be97f0b66577fb05cf45a29,pr6xg5,onelostsoul115,https://www.reddit.com/r/dataengineering/comments/pr6xg5/python_code_test_interview_general_career_advice/,Python Code Test (Interview) + general career advice,APACHE_KAFKA,data ingestion,"Their tech stack is as follows:  SQL, Python, Clojure, Scala, AWS:Glue, Athena, Redshift, Apache Airflow, Kafka, Spark, Terraform  I'm a bit worried about the Python code test as my day to day and expertise is still mainly in pl/sql and pl/pgsql, so I need to brush up on my Python",Kafka,107,112
24bc2cbf7734f8d88488ce4557cd7f37,pqty5b,scraper01,https://www.reddit.com/r/dataengineering/comments/pqty5b/stream_processing_tool_to_pair_with_kafka/,Stream processing tool to pair with Kafka,APACHE_KAFKA,data ingestion,"So far i've learnt Spark for big data ETL, a bit of Big Query for ELT, Apache Airflow for small data ETL,  and at last Kafka as a message passing queue",Kafka,120,125
6c81a358cba4c9d9f42cd0cc2159330d,pqty5b,scraper01,https://www.reddit.com/r/dataengineering/comments/pqty5b/stream_processing_tool_to_pair_with_kafka/,Stream processing tool to pair with Kafka,APACHE_KAFKA,data ingestion,"Between spark streaming, apache flink and apache storm, what do you think sinergizes the best with Kafka",Kafka,100,105
c85b90fcb22d6a157bc1f106936bcaea,ppuh5c,hatchikyu,https://www.reddit.com/r/dataengineering/comments/ppuh5c/if_i_had_to_explain_data_engineering_work_to_a/,If I had to explain data engineering work to a business colleague...,APACHE_KAFKA,data ingestion,"* Data architecture - distributed databases, traceability, data model definition * Business domain knowledge - know-how of industry working within, communicate findings with the audience at their level and intent of understanding  **10 years ago vs now**  * Ten years ago, data engineering was data warehousing, business intelligence and ETL * There was limited development of pipelines for analytical models * Very fast space now with a lot of directions you can go within the same org * Throwing myself in as an example, I'm now going into my 8th year in data, but still lack knowledge in K8s, Kafka beyond the surface level, massive-scale migration projects  **End up working in orgs with varying levels of DE maturity**  1",Kafka,597,602
910bc175b7b9b7fd89f8ed8bcebec134,pny53c,sgtbrecht,https://www.reddit.com/r/dataengineering/comments/pny53c/an_alternative_to_aws_solutions_architect_course/,An alternative to AWS Solutions Architect course on Udemy?,APACHE_KAFKA,data ingestion,"I still want to learn stuff like Airflow, Kafka, advanced SQL, advanced DWH...etc but I'm not sure what to focus on at this point",Kafka,43,48
53d993abd99b8e214ba23b2d18478708,pnlgxj,Away-Suggestion-5845,https://www.reddit.com/r/dataengineering/comments/pnlgxj/importing_data_question_kafka_vs_dwh/,Importing data question Kafka vs DWH,APACHE_KAFKA,data ingestion,"Hi everyone, someone asked me a technical question about Kafka",Kafka,58,63
99e7389506812e1d63455b4d348311bc,pnlgxj,Away-Suggestion-5845,https://www.reddit.com/r/dataengineering/comments/pnlgxj/importing_data_question_kafka_vs_dwh/,Importing data question Kafka vs DWH,APACHE_KAFKA,data ingestion,   There is a platform which uses relational Database and also Kafka to communicate and receive order data(and updates,Kafka,64,69
d1d4832bd0e3ebd641a29eaf186e25b5,pnlgxj,Away-Suggestion-5845,https://www.reddit.com/r/dataengineering/comments/pnlgxj/importing_data_question_kafka_vs_dwh/,Importing data question Kafka vs DWH,APACHE_KAFKA,data ingestion,Which of these method is a better approach:  An incremental load from the DB or importing data via Kafka into the DWH,Kafka,100,105
08b5b6d942717f0d12e59a95b1d1c3bf,pnlgxj,Away-Suggestion-5845,https://www.reddit.com/r/dataengineering/comments/pnlgxj/importing_data_question_kafka_vs_dwh/,Importing data question Kafka vs DWH,APACHE_KAFKA,data ingestion,  As i don't have any technical basics about Kafka i couldn't understand the question and respond it,Kafka,46,51
43c63e1a509da998aec0cd715f8a7388,pli0og,MediumZealousideal29,https://www.reddit.com/r/dataengineering/comments/pli0og/skills_required/,Skills required,APACHE_KAFKA,data ingestion,"I know SQL, hdfs, hive, control M..I also learned airflow, sqoop and basics of spark streaming, Kafka and AWS",Kafka,97,102
a9cf1cfcb0f35662f7e117fb89647594,pl5blv,putinwhat,https://www.reddit.com/r/dataengineering/comments/pl5blv/ingesting_data_into_delta_lake/,Ingesting data into Delta Lake,APACHE_KAFKA,data ingestion,The data is a mix of batch and streaming at the moment coming from Kafka.,Kafka,68,73
be09ee814f37aa456294258f2c84657b,pj6hoa,Away-Suggestion-5845,https://www.reddit.com/r/dataengineering/comments/pj6hoa/a_case_study_example_for_an_interview/,A Case Study Example for an Interview,APACHE_KAFKA,data ingestion,"  **Task 2:** Besides storing all data in a relational database, the event platform already uses Kafka to communicate updates between its different subsystems, opening up a completely new way of getting order infos for the DWH",Kafka,98,103
8d599b21cbbc889494257c2034e1b895,pj6hoa,Away-Suggestion-5845,https://www.reddit.com/r/dataengineering/comments/pj6hoa/a_case_study_example_for_an_interview/,A Case Study Example for an Interview,APACHE_KAFKA,data ingestion,or would you prefer importing order data via Kafka into the DWH,Kafka,46,51
4a687a387185ec4b022d17132731b597,ph15au,SukalpVashishtha,https://www.reddit.com/r/dataengineering/comments/ph15au/microservice_shared_database_antipattern_question/,Microservice shared database antipattern question,APACHE_KAFKA,data ingestion,  Is it a fair design pattern that a stream processing framework (spark/kafka streams etc,kafka,73,78
